"Team"	""	"Expression"	"Number"	"Description"	"Phase no."	""	"Expression"	"Expression"	"Expression"	"Expected time"	"Actual time"	"Remaining time"	""	""	""	
"YYSYB"	  0.00	"SHELL"	80293	"RPT - Integrated Reporting"	  14	"Generating PDF reports with non ASCII characters"	"As an X3 user I can generate PDF reports that contain non ASCII characters"	  0	"S016"	"Développement"	=""	=""	  0.00	  0.00	  0.00	
"YYSYB"	  0.00	"SHELL"	80293	"RPT - Integrated Reporting"	  15	"Select stylesheet for PDF report"	"As an X3 user I can select a CSS stylesheet for my PDF report"	  0	""	"Développement"	=""	=""	  0.00	  0.00	  0.00	
"YYSYB"	  0.00	"SHELL"	80293	"RPT - Integrated Reporting"	  15	"Select stylesheet for PDF report"	"As an X3 user I can select a CSS stylesheet for my PDF report"	  0	""	"Ergonomie"	=""	=""	  0.00	  0.00	  0.00	
"YYSYB"	  0.00	"SHELL"	80293	"RPT - Integrated Reporting"	  15	"Select stylesheet for PDF report"	"As an X3 user I can select a CSS stylesheet for my PDF report"	  0	""	"Développement"	=""	=""	  0.00	  0.00	  0.00	
"YYSYB"	  0.00	"SHELL"	80293	"RPT - Integrated Reporting"	  16	"Configuring multiple PDF reports on a page"	"As an X3 developer, partner or user I can configure serveral PDF reports on a given page."	  0	""	"Ergonomie"	=""	=""	  0.00	  0.00	  0.00	
"YYSYB"	  0.00	"SHELL"	80293	"RPT - Integrated Reporting"	  16	"Configuring multiple PDF reports on a page"	"As an X3 developer, partner or user I can configure serveral PDF reports on a given page."	  0	""	"Développement"	=""	=""	  0.00	  0.00	  0.00	
"YYSYB"	  0.00	"SHELL"	80293	"RPT - Integrated Reporting"	  17	"Generating 2-page wide PDF reports"	"As an X3 user I can generate a 2-page wide PDF report"	  0	""	"Ergonomie"	=""	=""	  0.00	  0.00	  0.00	
"YYSYB"	  0.00	"SHELL"	80293	"RPT - Integrated Reporting"	  17	"Generating 2-page wide PDF reports"	"As an X3 user I can generate a 2-page wide PDF report"	  0	""	"Développement"	=""	=""	  0.00	  0.00	  0.00	
"YYSYB"	  0.00	"SHELL"	80293	"RPT - Integrated Reporting"	  18	"Including images in PDF reports"	"As an X3 user I can include an image or a background image in a PDF report"	  0	"S016"	=""	=""	=""	  0.00	  0.00	  0.00	
"YYSYB"	  0.00	"SHELL"	80293	"RPT - Integrated Reporting"	  19	"Uploading stylesheets for PDF reports"	"As an X3 developer, partner or user, I can upload additional CSS stylesheets for PDF reports"	  0	""	=""	=""	=""	  0.00	  0.00	  0.00	
"YYSYB"	  0.00	"SHELL"	80330	"ADM - Document Storage Area"	   5	"ADM - Volumes in Storage Area"	"The user can create volumes and store documents as files into Syracuse"	  0	"S015"	=""	"Développement"	=""	  2.00	  4.00	  5.00	
"YYSYB"	  0.00	"SHELL"	80330	"ADM - Document Storage Area"	   6	"Create attachment from PC file"	"As an X3 user I can create a new attachment to an X3 resource by uploading a file from my PC"	  0	"S016"	"Développement"	=""	=""	  0.00	  0.00	  0.00	
"YYSYB"	  0.00	"SHELL"	80330	"ADM - Document Storage Area"	   7	"Update attachment from PC file"	"As an X3 user I can update an existing attachment to an X3 resource by uploading a file from my PC"	  0	"S016"	"Développement"	=""	=""	  0.00	  0.00	  0.00	
"YYSYB"	  0.00	"SHELL"	80330	"ADM - Document Storage Area"	   8	"Creating attachment by browsing files on an external volume"	"As an X3 user I can create an attachment to an X3 resource by browsing files on an external volume configured by the the administrator (external volume may be under the control of another application "	  0	"S016"	"Développement"	=""	=""	  0.00	  0.00	  0.00	
"YYSYB"	  0.00	"SHELL"	80330	"ADM - Document Storage Area"	   9	"Downloading attachement to local PC"	"As an X3 user I can download an attachment to an X3 resource to my PC"	  0	"S016"	"Développement"	=""	=""	  0.00	  0.00	  0.00	
"YYSYB"	  0.00	"SHELL"	80330	"ADM - Document Storage Area"	  10	"Uploading a document for a one time import"	"As an X3 user I can upload a document from my PC and use it as source for a one time import process"	  0	"S016"	"Développement"	=""	=""	  0.00	  0.00	  0.00	
"YYSYB"	  0.00	"SHELL"	80330	"ADM - Document Storage Area"	  11	"Configuring volumes for one time imports"	"As a syracuse admin I can configure the volumes where files will be uploaded for one time imports"	  0	"S016"	"Développement"	=""	=""	  0.00	  0.00	  0.00	
"YYSYB"	  0.00	"SHELL"	80330	"ADM - Document Storage Area"	  12	"Configuring volumes for automatic imports"	"As a syracuse admin I can configure the volumes where import process will automatically pick their files"	  0	"S016"	"Développement"	=""	=""	  0.00	  0.00	  0.00	
"YYSYB"	  0.00	"SHELL"	80330	"ADM - Document Storage Area"	  13	"Browsing through generated export files"	"As an X3 user I can browse through export files that have been generated by an X3 export process"	  0	"S016"	"Développement"	=""	=""	  0.00	  0.00	  0.00	
"YYSYB"	  0.00	"SHELL"	80330	"ADM - Document Storage Area"	  14	"Downloading an export file"	"As an X3 user I can download an export file that has been generated by an X3 process"	  0	"S016"	"Développement"	=""	=""	  0.00	  0.00	  0.00	
"YYSYB"	  0.00	"SHELL"	80330	"ADM - Document Storage Area"	  15	"Securing access to uploaded documents"	"As an X3 administrator I can guarantee that users only have access to the documents that they have uploaded or that their security profile authorizes"	  0	"S016"	"Développement"	=""	=""	  0.00	  0.00	  0.00	
"YYSYB"	  0.00	"SHELL"	82098	"ADM - Menus configuration"	   2	"ADM - Lookup X3 classes & representations"	=""	  0	"S013"	"Développement"	=""	=""	  0.00	  0.00	  0.50	
"YYSYB"	  0.00	"SHELL"	82098	"ADM - Menus configuration"	   3	"ADM - Lookup Fusion functions "	=""	  0	"S013"	"Développement"	=""	=""	  0.00	  0.00	  0.50	
"YYSYB"	  0.00	"SHELL"	82098	"ADM - Menus configuration"	   4	"ADM - Discovering and editing parameters"	=""	  0	"S013"	"Développement"	=""	=""	  0.00	  0.00	  2.00	
"YYSYB"	  0.00	"SHELL"	82098	"ADM - Menus configuration"	   5	"ADM - New options applied to the definition of menu items"	=""	  0	"S015"	=""	"Développement"	=""	  0.00	  0.50	  1.50	
"YYSYB"	  0.00	"SUPERVISOR"	75290	"Intégration vignettes BO"	   1	"Consultation BO dans dashboard et Syrapédia"	=""	  0	""	"Développement"	=""	=""	  0.00	  0.00	  0.00	
"YYSYB"	  0.00	"SUPERVISOR"	75343	"REST and SOAP Web services"	   1	"Configuring an incoming REST XML web service"	"As an X3 developer or partner I can configure an incoming REST XML (sData) web service"	  0	""	"Développement"	=""	=""	  0.00	  0.00	  0.00	
"YYSYB"	  0.00	"SUPERVISOR"	75343	"REST and SOAP Web services"	   2	"Configuring an incoming REST JSON web service"	"As an X3 developer or partner I can configure an incoming REST JSON (sData) web service"	  0	""	"Développement"	=""	=""	 25.00	  0.00	 25.00	
"YYSYB"	  0.00	"SUPERVISOR"	75343	"REST and SOAP Web services"	   3	"Referencing an X3 SOAP web service"	"As a Java or .NET developer, I can reference an X3 SOAP web service and generate client stubs for it"	  0	"S016"	"ordering, filtering and paging"	=""	=""	  2.00	  0.00	  2.00	
"YYSYB"	  0.00	"SUPERVISOR"	75343	"REST and SOAP Web services"	   3	"Referencing an X3 SOAP web service"	"As a Java or .NET developer, I can reference an X3 SOAP web service and generate client stubs for it"	  0	"S016"	"Dispatcher"	=""	=""	  1.00	  0.00	  1.00	
"YYSYB"	  0.00	"SUPERVISOR"	75343	"REST and SOAP Web services"	   3	"Referencing an X3 SOAP web service"	"As a Java or .NET developer, I can reference an X3 SOAP web service and generate client stubs for it"	  0	"S016"	"Transformation of request"	=""	=""	  5.00	  0.00	  5.00	
"YYSYB"	  0.00	"SUPERVISOR"	75343	"REST and SOAP Web services"	   3	"Referencing an X3 SOAP web service"	"As a Java or .NET developer, I can reference an X3 SOAP web service and generate client stubs for it"	  0	"S016"	"Enable WSDL on X3 represent."	=""	=""	  0.00	  0.00	  0.00	
"YYSYB"	  0.00	"SUPERVISOR"	75343	"REST and SOAP Web services"	   3	"Referencing an X3 SOAP web service"	"As a Java or .NET developer, I can reference an X3 SOAP web service and generate client stubs for it"	  0	"S016"	"WSDL Units Tests"	=""	=""	  0.00	  0.00	  0.00	
"YYSYB"	  0.00	"SUPERVISOR"	75343	"REST and SOAP Web services"	   4	"Calling an external REST JSON web service"	"As an X3 developer or partner I can call an external REST JSON web service from X3"	  0	""	"Développement"	=""	=""	  0.00	  0.00	  0.00	
"YYSYB"	  0.00	"SUPERVISOR"	75343	"REST and SOAP Web services"	   5	"Calling an external REST XML web service"	"As an X3 developer or partner I can call an external REST XML web service from X3"	  0	""	"Développement"	=""	=""	  0.00	  0.00	  0.00	
"YYSYB"	  0.00	"SUPERVISOR"	75343	"REST and SOAP Web services"	   6	"Calling an external SOAP web service"	"As an X3 developer or partner I can call an external SOAP web service from X3"	  0	""	"Analyse Développement"	=""	=""	  3.00	  0.00	  3.00	
"YYSYB"	  0.00	"SUPERVISOR"	75343	"REST and SOAP Web services"	  12	"Calling an X3 SOAP web service"	"As a Java or .NET developer, I can call an X3 SOAP web service"	  0	""	"SOAP Units Tests"	=""	=""	  0.00	  0.00	  0.00	
"YYSYB"	  0.00	"SUPERVISOR"	75343	"REST and SOAP Web services"	  12	"Calling an X3 SOAP web service"	"As a Java or .NET developer, I can call an X3 SOAP web service"	  0	""	"Développement"	=""	=""	  0.00	  0.00	  0.00	
"YYSYB"	  0.00	"SUPERVISOR"	75343	"REST and SOAP Web services"	  12	"Calling an X3 SOAP web service"	"As a Java or .NET developer, I can call an X3 SOAP web service"	  0	""	"SOAP calls on X3 represent."	=""	=""	  0.00	  0.00	  0.00	
"YYSYB"	  0.00	"SUPERVISOR"	75343	"REST and SOAP Web services"	  13	"Restricting access to selected JavaScript modules from X3"	"As a Syracuse administrator I will be able to control which JavaScript modules may be called from X3 so that X3 developers don't call potentially dangerous APIs."	  0	""	"Développement"	=""	=""	  0.00	  0.00	  0.00	
"YYSYB"	  0.00	"SUPERVISOR"	75358	"Adaptation des requêtes"	   1	"Vignette requête dans dashboard et Syrapédia"	=""	  0	"S016"	=""	"Développement"	=""	 45.00	 20.00	 25.00	
"YYSYB"	  0.00	"SUPERVISOR"	75410	"Adaptation des statistiques"	   1	"Vignette statistique dans dashboard et Syrapédia"	=""	  0	"S016"	=""	"Développement"	=""	 35.00	 20.00	 13.00	
"YYSYB"	  0.00	"SUPERVISOR"	75410	"Adaptation des statistiques"	   2	"Gestion critères statistiques"	=""	  0	""	"Developpement"	=""	=""	  0.00	  0.00	  0.00	
"YYSYB"	  0.00	"SUPERVISOR"	75417	"SUP - Reprise des plans de travail"	   1	"SUP - Reprise des plans de travail"	=""	  0	""	"Développement"	=""	=""	  0.00	  0.00	  0.00	
"YYSYB"	  0.00	"WIDGET-LIBRARY"	75387	"Extensibilité du framework UI Syracuse"	   1	"Extensibilité du framework UI"	=""	  0	""	"Analyse Développement"	=""	=""	  0.00	  0.00	  0.00	
"YYSYC"	  0.00	"ADONIX"	69072	"Gestion Heure et date locale"	   1	"Gestion Heure et date locale"	=""	  0	""	"Développement"	=""	=""	  0.00	  0.00	  0.00	
"YYSYC"	  0.00	"ADONIX"	69072	"Gestion Heure et date locale"	   1	"Gestion Heure et date locale"	=""	  0	""	=""	=""	"Analyse Produit"	  1.00	  1.00	  0.00	
"YYSYC"	  0.00	"ADONIX"	69763	"Impacts Syracuse sur runtime"	   2	"Sérialisation / désérialisation JSON"	=""	  0	""	=""	"Développement"	=""	  5.00	  9.50	  0.00	
"YYSYC"	  0.00	"ADONIX"	69763	"Impacts Syracuse sur runtime"	   2	"Sérialisation / désérialisation JSON"	=""	  0	""	=""	"Analyse développement"	=""	  2.00	  3.50	  0.00	
"YYSYC"	  0.00	"ADONIX"	75109	"ADX - Génération et lecture JSON par le moteur"	   1	"SUP - Génération et lecture JSON par le moteur"	=""	  0	""	"Développement"	=""	=""	 15.00	  0.00	 15.00	
"YYSYC"	  0.00	"ADONIX"	75241	"Gestion des blobs dans l'interface"	   2	"Gestion des blobs dans l'interface"	=""	  0	""	"Développement"	=""	=""	  5.00	  0.00	  5.00	
"YYSYC"	  0.00	"ADONIX"	83195	"Bufferisation des fde"	   1	"Bufferisation des fde"	=""	  0	""	"Développement"	=""	=""	 20.00	  0.00	 20.00	
"YYSYC"	  0.00	"ADONIX"	83238	"Valfill"	   1	"Analyse Valfill"	=""	  0	"S016"	"Analyse Développement"	=""	=""	  2.00	  0.00	  2.00	
"YYSYC"	  0.00	"ADONIX"	83238	"Valfill"	   1	"Analyse Valfill"	=""	  0	"S016"	"Analyse Développement"	=""	=""	  2.00	  0.00	  2.00	
"YYSYC"	  0.00	"ADONIX"	83238	"Valfill"	   2	"Developpement Valfill"	=""	  0	""	"Développement"	=""	=""	 20.00	  0.00	 20.00	
"YYSYC"	  0.00	"ADONIX"	83359	"Optimisation gestion memoire classe"	   1	"Optimisation gestion memoire classe"	=""	  0	"S016"	=""	"Analyse Développement"	=""	  5.00	  7.60	  4.50	
"YYSYC"	  0.00	"AUTHORING-MODE"	75091	"WPA - Reset"	   1	"WPA - Reset"	=""	  0	""	"Développement"	=""	=""	  1.00	  0.00	  1.00	
"YYSYC"	  0.00	"AUTHORING-MODE"	75168	"WPA - Grid Authoring Mode"	   1	"WPA - Grid Authoring Mode"	=""	  0	""	"Développement"	=""	=""	 30.00	  0.00	 30.00	
"YYSYC"	  0.00	"AUTHORING-MODE"	75168	"WPA - Grid Authoring Mode"	   1	"WPA - Grid Authoring Mode"	=""	  0	""	"Ergonomie"	=""	=""	 10.00	  0.00	 10.00	
"YYSYC"	  0.00	"AUTHORING-MODE"	75169	"WPA - Lookup Authoring Mode"	   1	"WPA - Lookup Authoring Mode"	=""	  0	""	"Ergonomie"	=""	=""	  5.00	  0.00	  5.00	
"YYSYC"	  0.00	"AUTHORING-MODE"	75169	"WPA - Lookup Authoring Mode"	   1	"WPA - Lookup Authoring Mode"	=""	  0	""	"Développement"	=""	=""	 10.00	  0.00	 10.00	
"YYSYC"	  0.00	"AUTHORING-MODE"	75170	"WPA - Children Authoring Mode"	   1	="75169"	=""	  0	""	"Ergonomie"	=""	=""	  5.00	  0.00	  5.00	
"YYSYC"	  0.00	"AUTHORING-MODE"	75170	"WPA - Children Authoring Mode"	   1	="75169"	=""	  0	""	"Développement"	=""	=""	 10.00	  0.00	 10.00	
"YYSYC"	  0.00	"AUTHORING-MODE"	83431	"Authoring général"	   4	"Authoring général"	"En tant qu'utilisateur je veux un authoring facile à utiliser"	  0	"S016"	=""	"Développement"	=""	  3.00	  1.00	  2.00	
"YYSYC"	  0.00	"AUTHORING-MODE"	83432	"Dashboard"	   1	"Améliorer la définition des dashboards et vignettes"	=""	  0	"S016"	=""	"Développement"	=""	  3.00	  0.50	  1.00	
"YYSYC"	  0.00	"AUTHORING-MODE"	83433	"Gestion des filtres"	   1	"Gestion des Quick filtres"	=""	  0	"S016"	"Développement"	=""	=""	  2.00	  0.00	  1.00	
"YYSYC"	  0.00	"AUTHORING-MODE"	83433	"Gestion des filtres"	   2	"Gestion des filtres avancés"	=""	  0	"S016"	"Développement"	=""	=""	  3.00	  0.00	  0.50	
"YYSYC"	  0.00	"EVOLUTION"	18769	"Points d'entrée"	   1	"Points d'entrée"	=""	  0	""	=""	=""	"Analyse Produit"	  1.00	  1.00	  0.00	
"YYSYC"	  0.00	"EVOLUTION"	18769	"Points d'entrée"	   1	"Points d'entrée"	=""	  0	""	"Développement"	=""	=""	  8.00	  0.00	  8.00	
"YYSYC"	  0.00	"EVOLUTION"	69441	"tache comptable instable apres arret brutal"	   1	"tache comptable instable apres arret brutal"	=""	  0	""	=""	=""	"Revue analyse / Indus"	  0.00	  0.00	  0.00	
"YYSYC"	  0.00	"EVOLUTION"	69441	"tache comptable instable apres arret brutal"	   1	"tache comptable instable apres arret brutal"	=""	  0	""	"Développement"	=""	=""	  2.00	  0.00	  2.00	
"YYSYC"	  0.00	"EVOLUTION"	69441	"tache comptable instable apres arret brutal"	   1	"tache comptable instable apres arret brutal"	=""	  0	""	=""	=""	"Industrialisation"	  0.00	  0.00	  0.00	
"YYSYC"	  0.00	"EVOLUTION"	73572	"Gestion de langues delta"	   1	"Gestion de langues delta"	=""	  0	""	=""	=""	"Analyse Produit"	  0.50	  0.50	  0.00	
"YYSYC"	  0.00	"EVOLUTION"	73572	"Gestion de langues delta"	   1	"Gestion de langues delta"	=""	  0	""	"Développement"	=""	=""	  5.00	  0.00	  5.00	
"YYSYC"	  0.00	"EVOLUTION"	74601	"Permettre l'exécution de tâches batch sur plusieurs serveurs"	   1	"Permettre l'exécution de tâches batch sur plusieurs serveurs"	=""	  0	""	"Analyse Produit"	=""	=""	  0.50	  0.00	  0.50	
"YYSYC"	  0.00	"EVOLUTION"	74601	"Permettre l'exécution de tâches batch sur plusieurs serveurs"	   1	"Permettre l'exécution de tâches batch sur plusieurs serveurs"	=""	  0	""	"Développement"	=""	=""	 10.00	  0.00	 10.00	
"YYSYC"	  0.00	"FUSION"	84542	"SYRAFUSION* Analyse/Détection"	   1	"SYRAFUSION* Analyse/Détection S016"	"En tant que développeur du framework FUSION j'assiste et analyse les problèmes remontés lors du sprint 16"	  0	"S016"	"Analyse Développement"	=""	=""	  5.00	  0.00	  5.00	
"YYSYC"	  0.00	"FUSION"	84542	"SYRAFUSION* Analyse/Détection"	   1	"SYRAFUSION* Analyse/Détection S016"	"En tant que développeur du framework FUSION j'assiste et analyse les problèmes remontés lors du sprint 16"	  0	"S016"	=""	"Analyse Développement"	=""	  2.00	  0.50	  1.50	
"YYSYC"	  0.00	"FUSION"	84543	"SYRAFUSION* Gestion des dates"	   1	"Gestion des dates en mode liste"	"En tant qu'utilisateur je veux disposer d'aide et de controle lors de la saisie des champs dates en mode liste"	  0	"S016"	"Développement"	=""	=""	  2.00	  0.00	  2.00	
"YYSYC"	  0.00	"FUSION"	84543	"SYRAFUSION* Gestion des dates"	   2	"SYRAFUSION* Gestion des dates"	"En tant qu'utilisateur je veux disposer d'aide et de controle lors de la saisie des champs dates dans les tableaux"	  0	""	"Développement"	=""	=""	  2.00	  0.00	  2.00	
"YYSYC"	  0.00	"FUSION"	84546	"SYRAFUSION* fenêtres de test"	   1	"SYRAFUSION* fenêtres de test"	"En temps que qualititien ou développeur je veux avoir des fêntres me permettant de tester de manière unitaire les comportements de l'interface fusion"	  0	"S016"	"Validation Qualité Manuelle"	=""	=""	  7.00	  0.00	  7.00	
"YYSYC"	  0.00	"FUSION"	84546	"SYRAFUSION* fenêtres de test"	   1	"SYRAFUSION* fenêtres de test"	"En temps que qualititien ou développeur je veux avoir des fêntres me permettant de tester de manière unitaire les comportements de l'interface fusion"	  0	"S016"	=""	"Développement"	=""	 30.00	  6.00	 24.00	
"YYSYC"	  0.00	"GENERAL"	82863	"Gestion des menus"	   3	"Gestion des menus X3"	=""	  0	""	"Développement"	=""	=""	  4.00	  0.00	  4.00	
"YYSYC"	  0.00	"GENERAL"	82867	"Mise à jour des dictionnaires (vocabulaire)"	   1	"Mise à jour des dictionnaires (vocabulaire)"	=""	  0	""	"Développement"	=""	=""	  2.00	  0.00	  2.00	
"YYSYC"	  0.00	"GENERAL"	83233	"Gestion des classes tampons"	   1	"Gestion des classes tampons"	"En tant que développeur je veux disposer d'un mécanisme qui me permette de mettre n mémoire des informations que j'utilise beaucoup"	  0	"S016"	"Développement"	=""	=""	 10.00	  0.00	 10.00	
"YYSYC"	  0.00	"GENERAL"	83237	"Validation à la volée des classes et représentations"	   1	"Validation à la volée des classes et représentations"	=""	  0	""	"Développement"	=""	=""	 20.00	  0.00	 20.00	
"YYSYC"	  0.00	"GENERAL"	83237	"Validation à la volée des classes et représentations"	   2	"Analyse validation à la volée des classes et représentations"	=""	  0	"S016"	=""	"Analyse Développement"	=""	  2.00	  0.20	  1.80	
"YYSYC"	  0.00	"GENERAL"	83237	"Validation à la volée des classes et représentations"	   2	"Analyse validation à la volée des classes et représentations"	=""	  0	"S016"	"Analyse Développement"	=""	=""	  2.00	  0.00	  2.00	
"YYSYC"	  0.00	"GENERAL"	83244	"Gestion option collection"	   2	"Prise en compte option collection"	"En tant qu'utilisateur je veux que les liens sur les collections reflètent le paramétrage des collections"	  0	"S016"	"Développement"	=""	=""	  3.00	  0.00	  3.00	
"YYSYC"	  0.00	"GENERAL"	83245	"Gestion des setups"	   1	"Gestion des setups"	=""	  0	""	"Développement"	=""	=""	 10.00	  0.00	 10.00	
"YYSYC"	  0.00	"GENERAL"	83292	"developpement et tests objets standards superviseur"	   1	"developpement et tests classe XXX"	"En tant qu'utilisateur je veux pouvoir accéder aux informations de XXXX directement en Syracuse"	  0	"S016"	"Développement"	=""	=""	  4.00	  0.00	  4.00	
"YYSYC"	  0.00	"GENERAL"	83292	"developpement et tests objets standards superviseur"	   2	"developpement et tests objets standards superviseur"	"En tant qu'utilisateur je veux pouvoir accéder aux entitées du dictionnaire X3 directement en Syracuse"	  0	"S016"	=""	"Développement"	=""	  5.00	  0.50	  4.50	
"YYSYC"	  0.00	"GENERAL"	83292	"developpement et tests objets standards superviseur"	   3	"developpement et tests objets standards superviseur"	"En tant qu'utilisateur je veux pouvoir accéder aux entitées du dictionnaire X3 directement en Syracuse"	  0	"S016"	=""	"Développement"	=""	  4.00	  0.50	  0.50	
"YYSYC"	  0.00	"GENERAL"	83292	"developpement et tests objets standards superviseur"	   4	"developpement et tests objets standards superviseur"	"En tant qu'utilisateur je veux pouvoir accéder aux informations de XXXX directement en Syracuse"	  0	"S016"	=""	"Développement"	=""	  4.00	  2.00	  2.00	
"YYSYC"	  0.00	"I18N"	75030	"LOC - ATEXTRA"	   2	"Saisie texte dans plusieurs langues"	=""	  0	""	"Développement"	=""	=""	  3.00	  0.00	  3.00	
"YYSYC"	  0.00	"MOBILITY"	75042	"Solution mobilité tablette"	   1	"WMA - IPad"	=""	  0	""	"Développement"	=""	=""	  0.00	  0.00	  0.00	
"YYSYC"	  0.00	"MOBILITY"	75043	"Offline Mode"	   1	"Offline Mode"	=""	  0	""	"Développement"	=""	=""	  0.00	  0.00	  0.00	
"YYSYC"	  0.00	"MOBILITY"	75106	"Solution mobilité smartphone"	  13	"Visualisation données X3"	=""	  0	"S014"	=""	"Développement"	=""	  6.00	  1.75	  4.25	
"YYSYC"	  0.00	"MOBILITY"	75106	"Solution mobilité smartphone"	  14	"Gestion du lookup"	=""	  0	"S014"	=""	"Développement"	=""	  4.00	  6.50	  0.00	
"YYSYC"	  0.00	"MOBILITY"	75106	"Solution mobilité smartphone"	  15	"Gestion des contrôles"	=""	  0	"S014"	=""	"Développement"	=""	 10.00	  5.00	  5.00	
"YYSYC"	  0.00	"MOBILITY"	75106	"Solution mobilité smartphone"	  16	"Gestion des tableaux "	=""	  0	"S014"	=""	"Développement"	=""	  4.00	  1.00	  3.00	
"YYSYC"	  0.00	"MULTILEG"	68606	"M_LEG : Processus et Législation"	   1	"Processus et Législation"	=""	  0	""	"Développement"	=""	=""	  5.00	  0.00	  5.00	
"YYSYC"	  0.00	"MULTILEG"	82864	"M_LEG : Table diverse, code législation obligatoire"	   1	"Table diverse internationale, code legislation obligatoire"	=""	  0	""	"Développement"	=""	=""	  1.00	  0.00	  1.00	
"YYSYC"	  0.00	"MULTILEG"	82932	"M_LEG :"toutes législations" en sélection table diverse"	   1	"Affichage "toutes législations" F12 sélection table diverse"	=""	  0	""	"Développement"	=""	=""	  1.00	  0.00	  1.00	
"YYSYC"	  0.00	"ONLINE-HELP"	75414	"Online Help Integration"	   1	"Online Help Integration"	=""	  0	""	"Développement"	=""	=""	 20.00	  0.00	 20.00	
"YYSYC"	  0.00	"SHELL"	75024	"Gestion des alertes et notifications"	   1	"Gestion des alertes et notifications client web"	=""	  0	""	"Développement"	=""	=""	  5.00	  0.00	  5.00	
"YYSYC"	  0.00	"SHELL"	75024	"Gestion des alertes et notifications"	   2	"Gestion des alertes et notifications client  smartphone"	=""	  0	""	"Développement"	=""	=""	  2.00	  0.00	  2.00	
"YYSYC"	  0.00	"SHELL"	75401	"SWS - Harmonisation des look"	   1	"SWS - Harmonisation des look "	=""	  0	""	"Développement"	=""	=""	 10.00	  0.00	 10.00	
"YYSYC"	  0.00	"SHELL"	83370	"Application de la charte Sage aux composants graphiques"	   1	"Application de la charte Sage aux composants graphiques"	=""	  0	"S016"	=""	"Infographie"	=""	  6.00	 14.00	 13.00	
"YYSYC"	  0.00	"SUPENHANCEMENTS"	84397	"Surveillance des utilisateurs"	   1	"Surveillance des utilisateurs"	"En tant qu'utilisateur je veux avoir sous Syracuse une fonction pour surveiller les connexions des utilisateurs (similaire à la fonction PSADX)"	  0	"S016"	=""	"Développement"	=""	  7.00	  2.00	  5.00	
"YYSYC"	  0.00	"SUPENHANCEMENTS"	84398	"Utilsation débuggeur"	   1	"Utilsation débuggeur"	"En tant que développeur je veux disposer d'une méthode de débuggage performante"	  0	"S016"	=""	"Tests croisés Développement"	=""	  6.00	  5.00	  1.00	
"YYSYC"	  0.00	"SUPENHANCEMENTS"	84476	"Optimisation protocol SAD"	   1	"Optimisation protocol SAD"	"En tant qu'utilisateur je veux un protocol SAD optimisé"	  0	"S016"	=""	"Développement"	=""	  2.00	  0.60	  1.40	
"YYSYC"	  0.00	"SUPENHANCEMENTS"	84477	"Optimisation archive"	   1	"Optimisation archive"	"En tant qu'utilisateur je veux une archive optimisé pour améliorer les perfs"	  0	"S016"	"Développement"	=""	=""	  1.00	  0.00	  1.00	
"YYSYC"	  0.00	"SUPERVISOR"	75017	"Gestion espace stockage"	   2	"Mise en place d'un espace de stokage des fichiers"	"En tant qu'administrateur X3 je veux pouvoir paramétrer un espace de stockage pour un dossier donné"	  0	"S016"	"Développement"	=""	=""	 17.00	  0.00	 17.00	
"YYSYC"	  0.00	"SUPERVISOR"	75017	"Gestion espace stockage"	   3	"Fonctions gestion espace de stockage"	"Le développeur dispose de fontions de gestions de fichiers sur l'espace de stockage de son dossier
"	  0	""	"Développement"	=""	=""	 10.00	  0.00	 10.00	
"YYSYC"	  0.00	"SUPERVISOR"	75017	"Gestion espace stockage"	   4	"Upload fichier "	"L'utilisateur peut uploder un fichier dans l'espace de stockage"	  0	""	"Développement"	=""	=""	  2.00	  0.00	  2.00	
"YYSYC"	  0.00	"SUPERVISOR"	75017	"Gestion espace stockage"	   5	"Sélection fichier"	"L'utilisateur peut sélectionner un fichier de l'espace de stokage"	  0	""	"Développement"	=""	=""	  0.00	  0.00	  0.00	
"YYSYC"	  0.00	"SUPERVISOR"	75017	"Gestion espace stockage"	   6	"Destination fichier"	"L'utilisateur peut choisir l'espace de stockage comme destination d'un fichier"	  0	""	"Développement"	=""	=""	  0.00	  0.00	  0.00	
"YYSYC"	  0.00	"SUPERVISOR"	75017	"Gestion espace stockage"	   7	"Téléchargement fichier"	"L'utilisateur peut télécharger un fichier depuis l'espace de stockage"	  0	""	"Développement"	=""	=""	  0.00	  0.00	  0.00	
"YYSYC"	  0.00	"SUPERVISOR"	75047	"Gestion des batchs"	   1	"Lancement des batchs"	=""	  0	""	"Développement"	=""	=""	  0.00	  0.00	  0.00	
"YYSYC"	  0.00	"SUPERVISOR"	75048	"Menux Locaux"	   1	"Gestion des menus locaux personnalisés"	=""	  0	""	"Développement"	=""	=""	 10.00	  0.00	 10.00	
"YYSYC"	  0.00	"SUPERVISOR"	75074	"Prise en compte des codes d accès"	   1	"Prise en compte des codes d accès"	=""	  0	""	"Développement"	=""	=""	 10.00	  0.00	 10.00	
