"Team"	""	"Expression"	"Number"	"Description"	"Phase no."	""	"Expression"	"Expression"	"Expression"	"Expected time"	"Actual time"	"Remaining time"	""	""	""	
"YYSYB"	  0.00	"ADMINISTRATION-TOOLS"	74563	"Contrôle domaine utilisateur en SSO"	 101	"0503 Environnement de tests pour SSO (multi-domaines)"	=""	  0	""	"Validation Qualité Manuelle"	=""	=""	  1.00	  0.00	  1.00	
"YYSYB"	  0.00	"ADMINISTRATION-TOOLS"	74563	"Contrôle domaine utilisateur en SSO"	 101	"0503 Environnement de tests pour SSO (multi-domaines)"	=""	  0	""	"Dossier X3 + config web"	=""	=""	  0.25	  0.00	  0.25	
"YYSYB"	  0.00	"ADMINISTRATION-TOOLS"	74563	"Contrôle domaine utilisateur en SSO"	 101	"0503 Environnement de tests pour SSO (multi-domaines)"	=""	  0	""	"Config X3"	=""	=""	  0.25	  0.00	  0.25	
"YYSYB"	  0.00	"ADMINISTRATION-TOOLS"	74563	"Contrôle domaine utilisateur en SSO"	 101	"0503 Environnement de tests pour SSO (multi-domaines)"	=""	  0	""	=""	=""	"Installation LDAP"	  1.00	  0.80	  0.00	
"YYSYB"	  0.00	"ADMINISTRATION-TOOLS"	75012	"DRAFT - Drafts 0.2"	   1	"DRAFT - Saisie"	=""	  0	""	"Développement"	=""	=""	 20.00	  0.00	 20.00	
"YYSYB"	  0.00	"ADMINISTRATION-TOOLS"	75019	"IAM - Sage ID Authentication"	   1	"Configuring syracuse for Sage ID authentication"	"As a syracuse administrator I can configure Syracuse to use Sage ID authentication (SSO)"	  0	""	"Développement"	=""	=""	 10.00	  0.00	 10.00	
"YYSYB"	  0.00	"ADMINISTRATION-TOOLS"	75019	"IAM - Sage ID Authentication"	   2	"Authenticating with Sage ID"	"As an X3 user I can authenticate using my Sage ID (SSO)"	  0	"S016"	=""	"Développement"	=""	  5.00	  2.50	  2.50	
"YYSYB"	  0.00	"ADMINISTRATION-TOOLS"	75020	"IAM - LDAP Authentication"	   2	"Updating syracuse user list from LDAP"	"The administrator can retrieve and update user instances from an LDAP server"	  0	""	"Développement"	=""	=""	  3.70	  0.00	  3.70	
"YYSYB"	  0.00	"ADMINISTRATION-TOOLS"	75020	"IAM - LDAP Authentication"	   2	"Updating syracuse user list from LDAP"	"The administrator can retrieve and update user instances from an LDAP server"	  0	""	=""	=""	"Développement"	  4.00	  0.30	  0.00	
"YYSYB"	  0.00	"ADMINISTRATION-TOOLS"	75021	"IAM - Users sync between X3 and Syracuse"	   1	"Initializing syracuse user list from X3"	"As a syracuse administrator I can initialize the user list from an existing X3 users table"	  0	""	"Développement"	=""	=""	  3.00	  0.00	  3.00	
"YYSYB"	  0.00	"ADMINISTRATION-TOOLS"	75021	"IAM - Users sync between X3 and Syracuse"	   2	"Synchronizing users from X3 to syracuse"	"As a syracuse administrator I can synchronize uses so that changes made in X3 are propagated to syracuse"	  0	""	"Développement"	=""	=""	  3.00	  0.00	  3.00	
"YYSYB"	  0.00	"ADMINISTRATION-TOOLS"	75021	"IAM - Users sync between X3 and Syracuse"	   3	"Synchronizing users from syracuse to X3"	"As a syracuse administrator I can synchronize uses so that changes made in syracuse are propagated to X3"	  0	""	"Développement"	=""	=""	  3.00	  0.00	  3.00	
"YYSYB"	  0.00	"ADMINISTRATION-TOOLS"	75023	"IAM - Access control on Syracuse resources"	   1	"Configuring access control on Syracuse resources"	"As a syracuse administrator I can give access rights to users on administration/collaboration functions"	  0	""	"Développement"	=""	=""	 30.00	  0.00	 30.00	
"YYSYB"	  0.00	"DEPLOYMENT"	75087	"Récupération du référentiel"	   3	"Récupération du référentiel"	=""	  0	"S015"	=""	"Qualité"	=""	  3.00	  5.75	  0.00	
"YYSYB"	  0.00	"DEPLOYMENT"	75087	"Récupération du référentiel"	   4	"Récupération du référentiel"	=""	  0	""	=""	"Développement"	=""	 35.00	 30.30	  4.70	
"YYSYB"	  0.00	"FLASH-COMPONENTS"	75036	"FLASH - Sage Visual Processes in Syracuse Pages"	   6	"VPP - Advanced graphical features"	"rotation, transformation, image, arrows"	  0	"S015"	=""	"Développement"	=""	  5.00	  8.50	  0.00	
"YYSYB"	  0.00	"FLASH-COMPONENTS"	75125	"FLASH - Link Business Logic to the Process Player "	   1	"Aspect dynamiue des processus"	=""	  0	""	"Développement"	=""	=""	  2.00	  0.00	  2.00	
"YYSYB"	  0.00	"FLASH-COMPONENTS"	75125	"FLASH - Link Business Logic to the Process Player "	   1	"Aspect dynamiue des processus"	=""	  0	""	=""	=""	"Développement"	  2.00	  1.80	  0.00	
"YYSYB"	  0.00	"FULL-TEXT-SEARCH"	77404	"FTS Elastic Search Integration"	   4	"Updating search index from X3"	"As a Syracuse admin, I can update the search index from X3 so that users get up-to-date search results."	  0	""	"Développement"	=""	=""	 15.00	  0.00	 15.00	
"YYSYB"	  0.00	"FULL-TEXT-SEARCH"	77404	"FTS Elastic Search Integration"	   6	"Scheduling search index updates"	"As a syracuse admin I can configure the frequency at which the search index will be updated."	  0	""	"Analyse Développement"	=""	=""	  0.00	  0.00	  0.00	
"YYSYB"	  0.00	"FULL-TEXT-SEARCH"	77404	"FTS Elastic Search Integration"	   6	"Scheduling search index updates"	"As a syracuse admin I can configure the frequency at which the search index will be updated."	  0	""	"Développement"	=""	=""	  0.00	  0.00	  0.00	
"YYSYB"	  0.00	"FULL-TEXT-SEARCH"	77404	"FTS Elastic Search Integration"	   7	"Configuring X3 search columns"	"As an X3 developer or partner I can configure the DB columns that will be indexed by the search engine"	  0	""	"Développement"	=""	=""	  0.00	  0.00	  0.00	
"YYSYB"	  0.00	"FULL-TEXT-SEARCH"	77404	"FTS Elastic Search Integration"	   8	"Searching X3 functions"	"As a user, I can search for X3 functions"	  0	""	=""	=""	=""	  0.00	  0.00	  0.00	
"YYSYB"	  0.00	"FULL-TEXT-SEARCH"	77404	"FTS Elastic Search Integration"	   9	"Searching X3 data"	"As a user, I can search for X3 data"	  0	""	=""	=""	=""	  0.00	  0.00	  0.00	
"YYSYB"	  0.00	"FULL-TEXT-SEARCH"	77404	"FTS Elastic Search Integration"	  10	"Searching Syracuse data"	"As a user, I can search for syracuse data (users, roles, teams, ...)"	  0	""	=""	=""	=""	  0.00	  0.00	  0.00	
"YYSYB"	  0.00	"FULL-TEXT-SEARCH"	77404	"FTS Elastic Search Integration"	  11	"Searching X3 documentation"	"As a user, I can search for X3 documentation"	  0	""	=""	=""	=""	  0.00	  0.00	  0.00	
"YYSYB"	  0.00	"FULL-TEXT-SEARCH"	77404	"FTS Elastic Search Integration"	  12	"Searching X3 attachments"	"As a user, I can search for X3 attachements"	  0	""	=""	=""	=""	  0.00	  0.00	  0.00	
"YYSYB"	  0.00	"FULL-TEXT-SEARCH"	77404	"FTS Elastic Search Integration"	  13	"Configuring X3 search security"	"As an X3 administrator I can configure security on search operations"	  0	""	=""	=""	=""	  0.00	  0.00	  0.00	
"YYSYB"	  0.00	"FULL-TEXT-SEARCH"	77404	"FTS Elastic Search Integration"	  14	"Configuring syracuse search security"	"As a Syracuse administrator I can configure security on search operations on syracuse data (users, roles, teams, etc)."	  0	""	=""	=""	=""	  0.00	  0.00	  0.00	
"YYSYB"	  0.00	"GENERAL"	75382	"Syracuse Patching"	   1	"Installing patch for X3 and Syracuse"	"As a system admin I can install a patch that updates both my X3 configuration and my Syracuse configuration."	  0	"S016"	=""	"Développement"	=""	 10.00	  8.00	  2.00	
"YYSYB"	  0.00	"GENERAL"	75382	"Syracuse Patching"	   2	"Creating combined X3/Syracuse patch"	"As an X3 release engineer I can create a patch that combines X3 and Syracuse patch elements"	  0	""	"Développement"	=""	=""	  1.00	  0.00	  1.00	
"YYSYB"	  0.00	"GENERAL"	75382	"Syracuse Patching"	   2	"Creating combined X3/Syracuse patch"	"As an X3 release engineer I can create a patch that combines X3 and Syracuse patch elements"	  0	""	"Développement"	=""	=""	  2.00	  0.00	  2.00	
"YYSYB"	  0.00	"GENERAL"	75382	"Syracuse Patching"	   3	"Creating Syracuse patch for Syracuse files"	"As a Syracuse developer I can create a patch element that updates the files (js, json, css) of a Syracuse server."	  0	"S015"	=""	"Développement"	=""	  6.00	  7.00	  1.00	
"YYSYB"	  0.00	"GENERAL"	75382	"Syracuse Patching"	   7	"Flagging mongodb elements that are deployed with the product"	"As a Sage X3 developer I can flag the mongodb elements (role definitions, layouts) that are deployed with the product. Only flagged elements will be included in patches."	  0	""	"Développement"	=""	=""	  5.00	  0.00	  5.00	
"YYSYB"	  0.00	"GENERAL"	75382	"Syracuse Patching"	   8	"Including mongodb resources in a patch"	"As a Sage X3 release engineer I can create a patch that contains mongodb resources (role definitions, layouts, etc.)"	  0	""	"Développement"	=""	=""	  5.00	  0.00	  5.00	
"YYSYB"	  0.00	"GENERAL"	75382	"Syracuse Patching"	   9	"Installing a patch that updates mongodb resources"	"As a system admin I can install a patch that contains updates to mongodb resources (role definitions, layouts, etc.)"	  0	""	"Développement"	=""	=""	  5.00	  0.00	  5.00	
"YYSYB"	  0.00	"GENERAL"	75382	"Syracuse Patching"	  10	"Verifying integrity of installation"	"As a system admin I can verify the integrity of my syracuse installation"	  0	""	"Développement"	=""	=""	  1.00	  0.00	  1.00	
"YYSYB"	  0.00	"GENERAL"	75382	"Syracuse Patching"	  11	"Creating patches between arbitrary versions"	"As a syracuse developper I can create a patch from any version to any version"	  0	""	"Développement"	=""	=""	  0.50	  0.00	  0.50	
"YYSYB"	  0.00	"GENERAL"	75382	"Syracuse Patching"	  12	"Listing patches"	"As a syracuse developper I can see a list of all patches in the administration UI"	  0	""	"Développement"	=""	=""	  1.00	  0.00	  1.00	
"YYSYB"	  0.00	"GENERAL"	75382	"Syracuse Patching"	  13	"Viewing patch metadata"	"As a syracuse administrator I can view the metadata of a patch (release number, comment, hash sum) in the administration UI"	  0	""	"Développement"	=""	=""	  0.50	  0.00	  0.50	
"YYSYB"	  0.00	"GENERAL"	75382	"Syracuse Patching"	  14	"Creating an image of an arbitrary release or SP"	"As a syracuse developer I can create an image of an arbitrary release or service pack which can then be used as a base release for the customer"	  0	""	"Développement"	=""	=""	  0.50	  0.00	  0.50	
"YYSYB"	  0.00	"GENERAL"	75382	"Syracuse Patching"	  15	"Running patch creation as an async job"	"As a syracuse developer I can run the patch creation process as an async job and monitor its progress"	  0	""	"Développement"	=""	=""	  1.00	  0.00	  1.00	
"YYSYB"	  0.00	"GENERAL"	75382	"Syracuse Patching"	  15	"Running patch creation as an async job"	"As a syracuse developer I can run the patch creation process as an async job and monitor its progress"	  0	""	"Développement"	=""	=""	  2.00	  0.00	  2.00	
"YYSYB"	  0.00	"GENERAL"	75382	"Syracuse Patching"	  15	"Running patch creation as an async job"	"As a syracuse developer I can run the patch creation process as an async job and monitor its progress"	  0	""	"Infographie"	=""	=""	  1.00	  0.00	  1.00	
"YYSYB"	  0.00	"GENERAL"	75382	"Syracuse Patching"	  15	"Running patch creation as an async job"	"As a syracuse developer I can run the patch creation process as an async job and monitor its progress"	  0	""	"Analyse Développement"	=""	=""	  1.00	  0.00	  1.00	
"YYSYB"	  0.00	"GENERAL"	82389	"Syracuse password authentication"	   1	"Authenticating with syracuse password"	"As a syracuse user, I can authenticate with my syracuse login and password"	  0	""	"Développement"	=""	=""	  0.00	  0.00	  0.00	
"YYSYB"	  0.00	"GENERAL"	82389	"Syracuse password authentication"	   2	"Resetting own password"	"As a syracuse user I can change my own password"	  0	""	"Développement"	=""	=""	  0.00	  0.00	  0.00	
"YYSYB"	  0.00	"GENERAL"	82389	"Syracuse password authentication"	   3	"Resetting lost user password"	"As a syracuse administrator I can reset a user's password. User will be required to change his password at first login.
"	  0	""	"Développement"	=""	=""	  0.00	  0.00	  0.00	
"YYSYB"	  0.00	"GENERAL"	82453	"SWS - Adaptation centrale pesée "	   1	"SWS - Adaptation centrale pesée "	=""	  0	""	"Analyse Développement"	=""	=""	  0.00	  0.00	  0.00	
"YYSYB"	  0.00	"I18N"	75031	"LOC - Syracuse server localization"	   1	"Localizing syracuse UI and messages"	"As a syracuse developer, I can externalize UI and message texts so that they can be localized"	  0	""	"Développement"	=""	=""	 10.00	  0.00	 10.00	
"YYSYB"	  0.00	"I18N"	75031	"LOC - Syracuse server localization"	   2	"Switching syracuse UI locale"	"As a syracuse user I can switch between language/country settings at runtime"	  0	""	"Développement"	=""	=""	  0.00	  0.00	  0.00	
"YYSYB"	  0.00	"I18N"	75031	"LOC - Syracuse server localization"	   3	"Translating syracuse texts"	"As a translator I can get the list of syracuse texts that need translation, and integrate my translations into syracuse."	  0	""	"Développement"	=""	=""	  0.00	  0.00	  0.00	
"YYSYB"	  0.00	"OFFICE-SUITE"	80295	"CLB - MS Excel integration"	   4	"Excel - Edit filters and display corresponding line count"	=""	  0	"S015"	"Développement"	=""	=""	  1.00	  0.00	  3.00	
"YYSYB"	  0.00	"OFFICE-SUITE"	80295	"CLB - MS Excel integration"	   9	"Excel - Define user functions"	=""	  0	"S013"	"Développement"	=""	=""	  0.00	  0.00	  0.00	
"YYSYB"	  0.00	"OFFICE-SUITE"	80295	"CLB - MS Excel integration"	  13	"Excel - Finalize Setup"	=""	  0	"S015"	"Unit Test"	=""	=""	  4.00	  0.00	  4.00	
"YYSYB"	  0.00	"OFFICE-SUITE"	80295	"CLB - MS Excel integration"	  13	"Excel - Finalize Setup"	=""	  0	"S015"	=""	=""	"Développement"	  3.00	  2.00	  0.00	
"YYSYB"	  0.00	"OFFICE-SUITE"	80296	"CLB - MS Word integration"	   2	"Mail merge"	"As an ERP User I can start a Word mail merge wherever an address list is displayed in the Sage ERP X3 client."	  0	"S016"	"Développement"	=""	=""	  0.50	  0.00	  0.50	
"YYSYB"	  0.00	"OFFICE-SUITE"	80296	"CLB - MS Word integration"	   3	"Sharing word documents"	"Within Word, it is possible to share documents in the colaboration space of Sage ERP X3. This feature is independent from the user role."	  0	"S016"	"Développement"	=""	=""	  1.00	  0.00	  1.00	
"YYSYB"	  0.00	"OFFICE-SUITE"	80296	"CLB - MS Word integration"	   4	"Send a letter"	"As an ERP User I can create a letter in Microsoft Word wherever a contact is displayed in the Sage ERP X3 client."	  0	""	"Développement"	=""	=""	  0.00	  0.00	  0.00	
"YYSYB"	  0.00	"OFFICE-SUITE"	80296	"CLB - MS Word integration"	   5	"Open syracuse .dot(x) files"	"As an ERP User I can open Word's "File"-"New"-Dialog to choose a template that is stored in the Syracuse collaboration space."	  0	"S016"	"Investigation"	=""	=""	  1.00	  0.00	  1.00	
"YYSYB"	  0.00	"OFFICE-SUITE"	80296	"CLB - MS Word integration"	   6	"Reporting in word (POC)"	"As an ERP User I can transfer data of any object to Word to beautify the output. To do that, I can choose an existing Document as a template or starting from scratch with a blank dokument. Once that's"	  0	"S016"	"Développement"	=""	=""	  2.00	  0.00	  2.00	
"YYSYB"	  0.00	"OFFICE-SUITE"	80296	"CLB - MS Word integration"	   6	"Reporting in word (POC)"	"As an ERP User I can transfer data of any object to Word to beautify the output. To do that, I can choose an existing Document as a template or starting from scratch with a blank dokument. Once that's"	  0	"S016"	"Développement"	=""	=""	  4.00	  0.00	  4.00	
"YYSYB"	  0.00	"PROJECT-MANAGEMENT"	75069	"PM - Continuous integration server"	   1	"PM - Continuous integration server"	=""	  0	""	"Développement"	=""	=""	 15.00	  0.00	 15.00	
"YYSYB"	  0.00	"PROJECT-MANAGEMENT"	75070	"PM -  Code coverage infrastructure"	   1	"PM - Code coverage infrastructure"	=""	  0	""	"Développement"	=""	=""	 15.00	  0.00	 15.00	
"YYSYB"	  0.00	"SHELL"	75015	"Vignettes"	   2	"Configuring vignettes"	"As a user or developer I can configure vignettes in a dashboard"	  0	""	"Développement"	=""	=""	  0.00	  0.00	  0.00	
"YYSYB"	  0.00	"SHELL"	75015	"Vignettes"	   4	"Adding and removing gadgets in a dashboard"	"As a user I can add and remove gadgets in a dashboard. I can choose new widgets from a palette of widgets."	  0	""	"Développement"	=""	=""	  0.00	  0.00	  0.00	
"YYSYB"	  0.00	"SHELL"	75015	"Vignettes"	   5	"Configuring gadgets"	"As a user I can configure the gadgets present in my dashboards"	  0	""	"Développement"	=""	=""	  0.00	  0.00	  0.00	
"YYSYB"	  0.00	"SHELL"	75015	"Vignettes"	   6	"Configuring default dashboards for roles"	"As an X3 developer I can configure different default dashboards for different roles"	  0	""	"Développement"	=""	=""	  0.00	  0.00	  0.00	
"YYSYB"	  0.00	"SHELL"	75015	"Vignettes"	   7	"Viewing X3 stats in a dashboard"	"As an X3 user, I will be able to view a vignette with X3 stats in a dashboard"	  0	""	"Développement"	=""	=""	  0.00	  0.00	  0.00	
"YYSYB"	  0.00	"SHELL"	75015	"Vignettes"	   8	"Viewing X3 query in a dashboard"	"As an X3 user, I will be able to view a vignette with an X3 query in a dashboard"	  0	""	"Développement"	=""	=""	  0.00	  0.00	  0.00	
"YYSYB"	  0.00	"SHELL"	75015	"Vignettes"	   9	"Migrating V6 dashboards to V7"	"As an X3 user, I will keep my existing V6 dashboard configurations when my X3 solution is upgraded to V7"	  0	"S016"	"Développement"	=""	=""	 15.00	  0.00	 15.00	
"YYSYB"	  0.00	"SHELL"	75062	"SWS - Drafts management"	   2	"Managing drafts"	"As a syracuse user, I can list my pending drafts and delete the drafts I'm not interested in."	  0	""	=""	=""	=""	  0.00	  0.00	  0.00	
"YYSYB"	  0.00	"SHELL"	75063	"SWS - History management"	   1	"Navigating through history"	"As an X3 user I can navigate through the activity pages that I have recently visited"	  0	""	"Développement"	=""	=""	  5.00	  0.00	  5.00	
"YYSYB"	  0.00	"SHELL"	75063	"SWS - History management"	   2	"Clearing history"	"As an X3 user I can clear my recent activity list"	  0	""	=""	=""	=""	  0.00	  0.00	  0.00	
"YYSYB"	  0.00	"SHELL"	75064	"SWS - Favorites management"	   1	"Working with favorites"	"As an X3 user I can mark any page as a favorite and get back to it by clicking on the corresponding link in my favorites menu."	  0	""	"Développement"	=""	=""	  0.00	  0.00	  0.00	
"YYSYB"	  0.00	"SHELL"	75064	"SWS - Favorites management"	   2	"Managing favorites"	"As an X3 user I can delete, reorder and rename entries in my favorites menu."	  0	""	=""	=""	=""	  0.00	  0.00	  0.00	
"YYSYB"	  0.00	"SHELL"	75251	"SWS - Dashboard"	   7	"Paramétrage du dashboard"	"En tant qu'utilisateur je dispose d'un dashboard qui marche. 
TODO: merge this with 75015 user stories"	  0	"S015"	=""	"Développement"	=""	  2.00	  5.00	  0.00	
"YYSYB"	  0.00	"SHELL"	75320	"Consultations Memos Management"	   1	"Consultations Memos Management"	=""	  0	""	"Développement"	=""	=""	 10.00	  0.00	 10.00	
"YYSYB"	  0.00	"SHELL"	75349	"SWL - Formulas Wizard "	   1	"SWL - Formulas Wizard "	=""	  0	""	"Développement"	=""	=""	  0.00	  0.00	  0.00	
"YYSYB"	  0.00	"SHELL"	75349	"SWL - Formulas Wizard "	   1	"SWL - Formulas Wizard "	=""	  0	""	"Développement"	=""	=""	  0.00	  0.00	  0.00	
"YYSYB"	  0.00	"SHELL"	75349	"SWL - Formulas Wizard "	   1	"SWL - Formulas Wizard "	=""	  0	""	"Analyse Développement"	=""	=""	  0.00	  0.00	  0.00	
"YYSYB"	  0.00	"SHELL"	75384	"License Management"	   1	"Limiting named users by role"	"As a Sage account manager I can deliver licenses that limit the number of named users for predefined ERP roles so that Sage can charge customers based on role usage"	  0	""	"Développement"	=""	=""	  0.00	  0.00	  0.00	
"YYSYB"	  0.00	"SHELL"	75384	"License Management"	   2	"Limiting concurrent users by role"	"As a Sage account manager I can deliver licenses that limit the number of concurrent users for predefined ERP roles so that Sage can charge customers based on role usage."	  0	""	"Développement"	=""	=""	  0.00	  0.00	  0.00	
"YYSYB"	  0.00	"SHELL"	75384	"License Management"	   3	"Limiting a license to a time window"	"As a Sage account manager I can set time windows on features that I include in a license so that Sage can sell features in subscription mode."	  0	""	"Développement"	=""	=""	  0.00	  0.00	  0.00	
"YYSYB"	  0.00	"SHELL"	75384	"License Management"	   4	"Warning users before license expires"	"As a syracuse administrator I will receive a notification when all or part of the application license is about to expire so that I can renew my license in time.."	  0	""	"Développement"	=""	=""	  0.00	  0.00	  0.00	
"YYSYB"	  0.00	"SHELL"	75384	"License Management"	   5	"Limiting volume on selected tables"	"As a Sage account manager I can deliver licenses that limit the number or valid records in specific tables so that Sage can charge according to the volume of data stored in the application."	  0	""	"Développement"	=""	=""	  0.00	  0.00	  0.00	
"YYSYB"	  0.00	"SHELL"	75384	"License Management"	   6	"Collecting usage counters"	"As a Sage account manager I can collect usage counters on specific tables so that Sage can charge according to the number of transactions (typically number of sales orders, number of pay slips, etc.) "	  0	""	"Développement"	=""	=""	  0.00	  0.00	  0.00	
"YYSYB"	  0.00	"SHELL"	75384	"License Management"	   7	"Monitoring usage counters"	"As a syracuse administrator I can monitor the usage counters defined by my license so that I can anticipate how much I will be charged by Sage."	  0	""	"Développement"	=""	=""	  0.00	  0.00	  0.00	
"YYSYB"	  0.00	"SHELL"	75384	"License Management"	   8	"Securing license file"	"As a Sage account manager I can create signed license files so that the application rejects the license if it has been tampered by a customer or partner."	  0	""	"Développement"	=""	=""	  0.00	  0.00	  0.00	
"YYSYB"	  0.00	"SHELL"	75384	"License Management"	   9	"Securing license logic"	"As a Sage developer I can sign and encrypt JavaScript files so that a customer or partner cannot short-circuit the logic that checks the license."	  0	""	"Développement"	=""	=""	  0.00	  0.00	  0.00	
"YYSYB"	  0.00	"SHELL"	75384	"License Management"	  10	"Configuring license badges"	"As a Sage product manager I can configure the list of functions that the license will unlock in a given badge so that Sage can tune its license policy."	  0	""	"Développement"	=""	=""	  0.00	  0.00	  0.00	
"YYSYB"	  0.00	"SHELL"	75384	"License Management"	  11	"Viewing the license"	"As a ERP User I can view the license of my software so that I can find out what has been purchased by my company."	  0	""	"Développement"	=""	=""	  0.00	  0.00	  0.00	
"YYSYB"	  0.00	"SHELL"	75384	"License Management"	  12	"Upgrading license"	"As a syracuse administrator I can activate a license that I have received from Sage so that my users can use the software according to the license that we purchased."	  0	""	"Développement"	=""	=""	  0.00	  0.00	  0.00	
"YYSYB"	  0.00	"SHELL"	75384	"License Management"	  13	"Generating demo licenses"	"As a Sage account manager I can deliver demo licenses so that Sage pre-sales and partners can demo the product."	  0	""	"Développement"	=""	=""	  0.00	  0.00	  0.00	
"YYSYB"	  0.00	"SHELL"	75384	"License Management"	  14	"Limiting license by a trial period"	"As a Sage ERP installer I can setup the software including a license with a trial period so that no additional action is needed to test the software."	  0	""	"Développement"	=""	=""	  0.00	  0.00	  0.00	
"YYSYB"	  0.00	"SHELL"	76065	"SWS - Interopérabilité Gantt"	   1	"SWS - Adaptation GANTT (X3)"	=""	  0	""	"Développement"	=""	=""	  0.00	  0.00	  0.00	
"YYSYB"	  0.00	"SHELL"	80291	"UI - RTF replacement"	   6	"RTF - improve HTML to RTF conversion"	"Improve RTF generated from HTML"	  0	"S016"	"Managed Raw Text"	=""	=""	  1.00	  0.00	  1.00	
"YYSYB"	  0.00	"SHELL"	80291	"UI - RTF replacement"	   6	"RTF - improve HTML to RTF conversion"	"Improve RTF generated from HTML"	  0	"S016"	"Unit Test"	=""	=""	  1.00	  0.00	  1.00	
"YYSYB"	  0.00	"SHELL"	80292	"UI - New graphics components"	  10	"WGT - Calendar integration"	=""	  0	""	"Développement"	=""	=""	  0.00	  0.00	  0.00	
"YYSYB"	  0.00	"SHELL"	80293	"RPT - Integrated Reporting"	   6	"Authoring of details PDF reports"	"As an X3 user I can customize the layout of a PDF report on a "details" page"	  0	""	"Développement"	=""	=""	  0.00	  0.00	  0.00	
"YYSYB"	  0.00	"SHELL"	80293	"RPT - Integrated Reporting"	   7	"Authoring of query PDF reports"	"As an X3 user I can customize the layout of a PDF report on a "query" page"	  0	""	"Développement"	=""	=""	  0.00	  0.00	  0.00	
"YYSYB"	  0.00	"SHELL"	80293	"RPT - Integrated Reporting"	   9	"Customizing PDF stylesheets"	"As an X3 developer or partner I can customize stylesheets for PDF reports (choose fonts, colors, background images, margins, etc.)."	  0	"S016"	"Développement"	=""	=""	  0.00	  0.00	  0.00	
"YYSYB"	  0.00	"SHELL"	80293	"RPT - Integrated Reporting"	  10	"Selecting page size and orientation"	"As an X3 user I can select page size and orientation for a PDF report"	  0	""	"Ergonomie"	=""	=""	  0.00	  0.00	  0.00	
"YYSYB"	  0.00	"SHELL"	80293	"RPT - Integrated Reporting"	  10	"Selecting page size and orientation"	"As an X3 user I can select page size and orientation for a PDF report"	  0	""	"Développement"	=""	=""	  0.00	  0.00	  0.00	
"YYSYB"	  0.00	"SHELL"	80293	"RPT - Integrated Reporting"	  10	"Selecting page size and orientation"	"As an X3 user I can select page size and orientation for a PDF report"	  0	""	"Développement"	=""	=""	  0.00	  0.00	  0.00	
"YYSYB"	  0.00	"SHELL"	80293	"RPT - Integrated Reporting"	  11	"Including tables in PDF reports"	"As an X3 user I can include tables for collections of child resources in a PDF report on a details representation"	  0	"S016"	=""	=""	=""	  0.00	  0.00	  0.00	
"YYSYB"	  0.00	"SHELL"	80293	"RPT - Integrated Reporting"	  12	"Including graphs in PDF reports"	"As an X3 user I can include graphs in a PDF report on a details representation"	  0	""	"Développement"	=""	=""	  0.00	  0.00	  0.00	
"YYSYB"	  0.00	"SHELL"	80293	"RPT - Integrated Reporting"	  13	"Generating PDF reports with headers and footers"	"As an X3 user I can define headers and footers for my PDF reports."	  0	""	"Développement"	=""	=""	  0.00	  0.00	  0.00	
