{
  "BA": [
    {
      "$uuid": 0,
      "$serverIndex": 0,
      "$rawV": {
        "BA2": {
          "fmt": null,
          "_fmtBySrv": null,
          "v": "20050101"
        },
        "BA3": {
          "v": "2005-01-01-00-6"
        },
        "BA4": {
          "v": "3"
        },
        "BA5": {
          "v": "0"
        },
        "BA6": {
          "v": "0"
        },
        "BA7": {
          "v": "0"
        },
        "BA8": {
          "v": "0"
        }
      },
      "BA2": "01/01/05",
      "BA3": "2005-01-01-00-6",
      "BA4": "3",
      "BA5": "0",
      "BA6": "0",
      "BA7": "0",
      "BA8": "0"
    },
    {
      "$uuid": 1,
      "$serverIndex": 1,
      "$rawV": {
        "BA2": {
          "fmt": null,
          "_fmtBySrv": null,
          "v": "20050102"
        },
        "BA3": {
          "v": "2005-01-02-00-7"
        },
        "BA4": {
          "v": "2"
        },
        "BA5": {
          "v": "0"
        },
        "BA6": {
          "v": "0"
        },
        "BA7": {
          "v": "0"
        },
        "BA8": {
          "v": "0"
        }
      },
      "BA2": "01/02/05",
      "BA3": "2005-01-02-00-7",
      "BA4": "2",
      "BA5": "0",
      "BA6": "0",
      "BA7": "0",
      "BA8": "0"
    },
    {
      "$uuid": 2,
      "$serverIndex": 2,
      "$rawV": {
        "BA2": {
          "fmt": null,
          "_fmtBySrv": null,
          "v": "20050103"
        },
        "BA3": {
          "v": "2005-01-03-01-1"
        },
        "BA4": {
          "v": "1"
        },
        "BA5": {
          "v": "1"
        },
        "BA6": {
          "v": "1"
        },
        "BA7": {
          "v": "0"
        },
        "BA8": {
          "v": "0"
        }
      },
      "BA2": "01/03/05",
      "BA3": "2005-01-03-01-1",
      "BA4": "1",
      "BA5": "1",
      "BA6": "1",
      "BA7": "0",
      "BA8": "0"
    },
    {
      "$uuid": 3,
      "$serverIndex": 3,
      "$rawV": {
        "BA2": {
          "fmt": null,
          "_fmtBySrv": null,
          "v": "20050104"
        },
        "BA3": {
          "v": "2005-01-04-01-2"
        },
        "BA4": {
          "v": "1"
        },
        "BA5": {
          "v": "1"
        },
        "BA6": {
          "v": "1"
        },
        "BA7": {
          "v": "0"
        },
        "BA8": {
          "v": "0"
        }
      },
      "BA2": "01/04/05",
      "BA3": "2005-01-04-01-2",
      "BA4": "1",
      "BA5": "1",
      "BA6": "1",
      "BA7": "0",
      "BA8": "0"
    },
    {
      "$uuid": 4,
      "$serverIndex": 4,
      "$rawV": {
        "BA2": {
          "fmt": null,
          "_fmtBySrv": null,
          "v": "20050105"
        },
        "BA3": {
          "v": "2005-01-05-01-3"
        },
        "BA4": {
          "v": "1"
        },
        "BA5": {
          "v": "1"
        },
        "BA6": {
          "v": "1"
        },
        "BA7": {
          "v": "0"
        },
        "BA8": {
          "v": "0"
        }
      },
      "BA2": "01/05/05",
      "BA3": "2005-01-05-01-3",
      "BA4": "1",
      "BA5": "1",
      "BA6": "1",
      "BA7": "0",
      "BA8": "0"
    },
    {
      "$uuid": 5,
      "$serverIndex": 5,
      "$rawV": {
        "BA2": {
          "fmt": null,
          "_fmtBySrv": null,
          "v": "20050106"
        },
        "BA3": {
          "v": "2005-01-06-01-4"
        },
        "BA4": {
          "v": "1"
        },
        "BA5": {
          "v": "1"
        },
        "BA6": {
          "v": "1"
        },
        "BA7": {
          "v": "0"
        },
        "BA8": {
          "v": "0"
        }
      },
      "BA2": "01/06/05",
      "BA3": "2005-01-06-01-4",
      "BA4": "1",
      "BA5": "1",
      "BA6": "1",
      "BA7": "0",
      "BA8": "0"
    },
    {
      "$uuid": 6,
      "$serverIndex": 6,
      "$rawV": {
        "BA2": {
          "fmt": null,
          "_fmtBySrv": null,
          "v": "20050107"
        },
        "BA3": {
          "v": "2005-01-07-01-5"
        },
        "BA4": {
          "v": "1"
        },
        "BA5": {
          "v": "1"
        },
        "BA6": {
          "v": "1"
        },
        "BA7": {
          "v": "0"
        },
        "BA8": {
          "v": "0"
        }
      },
      "BA2": "01/07/05",
      "BA3": "2005-01-07-01-5",
      "BA4": "1",
      "BA5": "1",
      "BA6": "1",
      "BA7": "0",
      "BA8": "0"
    },
    {
      "$uuid": 7,
      "$serverIndex": 7,
      "$rawV": {
        "BA2": {
          "fmt": null,
          "_fmtBySrv": null,
          "v": "20050108"
        },
        "BA3": {
          "v": "2005-01-08-01-6"
        },
        "BA4": {
          "v": "2"
        },
        "BA5": {
          "v": "0"
        },
        "BA6": {
          "v": "0"
        },
        "BA7": {
          "v": "0"
        },
        "BA8": {
          "v": "0"
        }
      },
      "BA2": "01/08/05",
      "BA3": "2005-01-08-01-6",
      "BA4": "2",
      "BA5": "0",
      "BA6": "0",
      "BA7": "0",
      "BA8": "0"
    },
    {
      "$uuid": 8,
      "$serverIndex": 8,
      "$rawV": {
        "BA2": {
          "fmt": null,
          "_fmtBySrv": null,
          "v": "20050109"
        },
        "BA3": {
          "v": "2005-01-09-01-7"
        },
        "BA4": {
          "v": "2"
        },
        "BA5": {
          "v": "0"
        },
        "BA6": {
          "v": "0"
        },
        "BA7": {
          "v": "0"
        },
        "BA8": {
          "v": "0"
        }
      },
      "BA2": "01/09/05",
      "BA3": "2005-01-09-01-7",
      "BA4": "2",
      "BA5": "0",
      "BA6": "0",
      "BA7": "0",
      "BA8": "0"
    },
    {
      "$uuid": 9,
      "$serverIndex": 9,
      "$rawV": {
        "BA2": {
          "fmt": null,
          "_fmtBySrv": null,
          "v": "20050110"
        },
        "BA3": {
          "v": "2005-01-10-02-1"
        },
        "BA4": {
          "v": "1"
        },
        "BA5": {
          "v": "1"
        },
        "BA6": {
          "v": "1"
        },
        "BA7": {
          "v": "0"
        },
        "BA8": {
          "v": "0"
        }
      },
      "BA2": "01/10/05",
      "BA3": "2005-01-10-02-1",
      "BA4": "1",
      "BA5": "1",
      "BA6": "1",
      "BA7": "0",
      "BA8": "0"
    },
    {
      "$uuid": 10,
      "$serverIndex": 10,
      "$rawV": {
        "BA2": {
          "fmt": null,
          "_fmtBySrv": null,
          "v": "20050111"
        },
        "BA3": {
          "v": "2005-01-11-02-2"
        },
        "BA4": {
          "v": "1"
        },
        "BA5": {
          "v": "1"
        },
        "BA6": {
          "v": "1"
        },
        "BA7": {
          "v": "0"
        },
        "BA8": {
          "v": "0"
        }
      },
      "BA2": "01/11/05",
      "BA3": "2005-01-11-02-2",
      "BA4": "1",
      "BA5": "1",
      "BA6": "1",
      "BA7": "0",
      "BA8": "0"
    },
    {
      "$uuid": 11,
      "$serverIndex": 11,
      "$rawV": {
        "BA2": {
          "fmt": null,
          "_fmtBySrv": null,
          "v": "20050112"
        },
        "BA3": {
          "v": "2005-01-12-02-3"
        },
        "BA4": {
          "v": "1"
        },
        "BA5": {
          "v": "1"
        },
        "BA6": {
          "v": "1"
        },
        "BA7": {
          "v": "0"
        },
        "BA8": {
          "v": "0"
        }
      },
      "BA2": "01/12/05",
      "BA3": "2005-01-12-02-3",
      "BA4": "1",
      "BA5": "1",
      "BA6": "1",
      "BA7": "0",
      "BA8": "0"
    },
    {
      "$uuid": 12,
      "$serverIndex": 12,
      "$rawV": {
        "BA2": {
          "fmt": null,
          "_fmtBySrv": null,
          "v": "20050113"
        },
        "BA3": {
          "v": "2005-01-13-02-4"
        },
        "BA4": {
          "v": "1"
        },
        "BA5": {
          "v": "1"
        },
        "BA6": {
          "v": "1"
        },
        "BA7": {
          "v": "0"
        },
        "BA8": {
          "v": "0"
        }
      },
      "BA2": "01/13/05",
      "BA3": "2005-01-13-02-4",
      "BA4": "1",
      "BA5": "1",
      "BA6": "1",
      "BA7": "0",
      "BA8": "0"
    },
    {
      "$uuid": 13,
      "$serverIndex": 13,
      "$rawV": {
        "BA2": {
          "fmt": null,
          "_fmtBySrv": null,
          "v": "20050114"
        },
        "BA3": {
          "v": "2005-01-14-02-5"
        },
        "BA4": {
          "v": "1"
        },
        "BA5": {
          "v": "1"
        },
        "BA6": {
          "v": "1"
        },
        "BA7": {
          "v": "0"
        },
        "BA8": {
          "v": "0"
        }
      },
      "BA2": "01/14/05",
      "BA3": "2005-01-14-02-5",
      "BA4": "1",
      "BA5": "1",
      "BA6": "1",
      "BA7": "0",
      "BA8": "0"
    },
    {
      "$uuid": 14,
      "$serverIndex": 14,
      "$rawV": {
        "BA2": {
          "fmt": null,
          "_fmtBySrv": null,
          "v": "20050115"
        },
        "BA3": {
          "v": "2005-01-15-02-6"
        },
        "BA4": {
          "v": "2"
        },
        "BA5": {
          "v": "0"
        },
        "BA6": {
          "v": "0"
        },
        "BA7": {
          "v": "0"
        },
        "BA8": {
          "v": "0"
        }
      },
      "BA2": "01/15/05",
      "BA3": "2005-01-15-02-6",
      "BA4": "2",
      "BA5": "0",
      "BA6": "0",
      "BA7": "0",
      "BA8": "0"
    },
    {
      "$uuid": 15,
      "$serverIndex": 15,
      "$rawV": {
        "BA2": {
          "fmt": null,
          "_fmtBySrv": null,
          "v": "20050116"
        },
        "BA3": {
          "v": "2005-01-16-02-7"
        },
        "BA4": {
          "v": "2"
        },
        "BA5": {
          "v": "0"
        },
        "BA6": {
          "v": "0"
        },
        "BA7": {
          "v": "0"
        },
        "BA8": {
          "v": "0"
        }
      },
      "BA2": "01/16/05",
      "BA3": "2005-01-16-02-7",
      "BA4": "2",
      "BA5": "0",
      "BA6": "0",
      "BA7": "0",
      "BA8": "0"
    },
    {
      "$uuid": 16,
      "$serverIndex": 16,
      "$rawV": {
        "BA2": {
          "fmt": null,
          "_fmtBySrv": null,
          "v": "20050117"
        },
        "BA3": {
          "v": "2005-01-17-03-1"
        },
        "BA4": {
          "v": "1"
        },
        "BA5": {
          "v": "1"
        },
        "BA6": {
          "v": "1"
        },
        "BA7": {
          "v": "0"
        },
        "BA8": {
          "v": "0"
        }
      },
      "BA2": "01/17/05",
      "BA3": "2005-01-17-03-1",
      "BA4": "1",
      "BA5": "1",
      "BA6": "1",
      "BA7": "0",
      "BA8": "0"
    },
    {
      "$uuid": 17,
      "$serverIndex": 17,
      "$rawV": {
        "BA2": {
          "fmt": null,
          "_fmtBySrv": null,
          "v": "20050118"
        },
        "BA3": {
          "v": "2005-01-18-03-2"
        },
        "BA4": {
          "v": "1"
        },
        "BA5": {
          "v": "1"
        },
        "BA6": {
          "v": "1"
        },
        "BA7": {
          "v": "0"
        },
        "BA8": {
          "v": "0"
        }
      },
      "BA2": "01/18/05",
      "BA3": "2005-01-18-03-2",
      "BA4": "1",
      "BA5": "1",
      "BA6": "1",
      "BA7": "0",
      "BA8": "0"
    },
    {
      "$uuid": 18,
      "$serverIndex": 18,
      "$rawV": {
        "BA2": {
          "fmt": null,
          "_fmtBySrv": null,
          "v": "20050119"
        },
        "BA3": {
          "v": "2005-01-19-03-3"
        },
        "BA4": {
          "v": "1"
        },
        "BA5": {
          "v": "1"
        },
        "BA6": {
          "v": "1"
        },
        "BA7": {
          "v": "0"
        },
        "BA8": {
          "v": "0"
        }
      },
      "BA2": "01/19/05",
      "BA3": "2005-01-19-03-3",
      "BA4": "1",
      "BA5": "1",
      "BA6": "1",
      "BA7": "0",
      "BA8": "0"
    },
    {
      "$uuid": 19,
      "$serverIndex": 19,
      "$rawV": {
        "BA2": {
          "fmt": null,
          "_fmtBySrv": null,
          "v": "20050120"
        },
        "BA3": {
          "v": "2005-01-20-03-4"
        },
        "BA4": {
          "v": "1"
        },
        "BA5": {
          "v": "1"
        },
        "BA6": {
          "v": "1"
        },
        "BA7": {
          "v": "0"
        },
        "BA8": {
          "v": "0"
        }
      },
      "BA2": "01/20/05",
      "BA3": "2005-01-20-03-4",
      "BA4": "1",
      "BA5": "1",
      "BA6": "1",
      "BA7": "0",
      "BA8": "0"
    },
    {
      "$uuid": 20,
      "$serverIndex": 20,
      "$rawV": {
        "BA2": {
          "fmt": null,
          "_fmtBySrv": null,
          "v": "20050121"
        },
        "BA3": {
          "v": "2005-01-21-03-5"
        },
        "BA4": {
          "v": "1"
        },
        "BA5": {
          "v": "1"
        },
        "BA6": {
          "v": "1"
        },
        "BA7": {
          "v": "0"
        },
        "BA8": {
          "v": "0"
        }
      },
      "BA2": "01/21/05",
      "BA3": "2005-01-21-03-5",
      "BA4": "1",
      "BA5": "1",
      "BA6": "1",
      "BA7": "0",
      "BA8": "0"
    },
    {
      "$uuid": 21,
      "$serverIndex": 21,
      "$rawV": {
        "BA2": {
          "fmt": null,
          "_fmtBySrv": null,
          "v": "20050122"
        },
        "BA3": {
          "v": "2005-01-22-03-6"
        },
        "BA4": {
          "v": "2"
        },
        "BA5": {
          "v": "0"
        },
        "BA6": {
          "v": "0"
        },
        "BA7": {
          "v": "0"
        },
        "BA8": {
          "v": "0"
        }
      },
      "BA2": "01/22/05",
      "BA3": "2005-01-22-03-6",
      "BA4": "2",
      "BA5": "0",
      "BA6": "0",
      "BA7": "0",
      "BA8": "0"
    },
    {
      "$uuid": 22,
      "$serverIndex": 22,
      "$rawV": {
        "BA2": {
          "fmt": null,
          "_fmtBySrv": null,
          "v": "20050123"
        },
        "BA3": {
          "v": "2005-01-23-03-7"
        },
        "BA4": {
          "v": "2"
        },
        "BA5": {
          "v": "0"
        },
        "BA6": {
          "v": "0"
        },
        "BA7": {
          "v": "0"
        },
        "BA8": {
          "v": "0"
        }
      },
      "BA2": "01/23/05",
      "BA3": "2005-01-23-03-7",
      "BA4": "2",
      "BA5": "0",
      "BA6": "0",
      "BA7": "0",
      "BA8": "0"
    },
    {
      "$uuid": 23,
      "$serverIndex": 23,
      "$rawV": {
        "BA2": {
          "fmt": null,
          "_fmtBySrv": null,
          "v": "20050124"
        },
        "BA3": {
          "v": "2005-01-24-04-1"
        },
        "BA4": {
          "v": "1"
        },
        "BA5": {
          "v": "1"
        },
        "BA6": {
          "v": "1"
        },
        "BA7": {
          "v": "0"
        },
        "BA8": {
          "v": "0"
        }
      },
      "BA2": "01/24/05",
      "BA3": "2005-01-24-04-1",
      "BA4": "1",
      "BA5": "1",
      "BA6": "1",
      "BA7": "0",
      "BA8": "0"
    },
    {
      "$uuid": 24,
      "$serverIndex": 24,
      "$rawV": {
        "BA2": {
          "fmt": null,
          "_fmtBySrv": null,
          "v": "20050125"
        },
        "BA3": {
          "v": "2005-01-25-04-2"
        },
        "BA4": {
          "v": "1"
        },
        "BA5": {
          "v": "1"
        },
        "BA6": {
          "v": "1"
        },
        "BA7": {
          "v": "0"
        },
        "BA8": {
          "v": "0"
        }
      },
      "BA2": "01/25/05",
      "BA3": "2005-01-25-04-2",
      "BA4": "1",
      "BA5": "1",
      "BA6": "1",
      "BA7": "0",
      "BA8": "0"
    },
    {
      "$uuid": 25,
      "$serverIndex": 25,
      "$rawV": {
        "BA2": {
          "fmt": null,
          "_fmtBySrv": null,
          "v": "20050126"
        },
        "BA3": {
          "v": "2005-01-26-04-3"
        },
        "BA4": {
          "v": "1"
        },
        "BA5": {
          "v": "1"
        },
        "BA6": {
          "v": "1"
        },
        "BA7": {
          "v": "0"
        },
        "BA8": {
          "v": "0"
        }
      },
      "BA2": "01/26/05",
      "BA3": "2005-01-26-04-3",
      "BA4": "1",
      "BA5": "1",
      "BA6": "1",
      "BA7": "0",
      "BA8": "0"
    },
    {
      "$uuid": 26,
      "$serverIndex": 26,
      "$rawV": {
        "BA2": {
          "fmt": null,
          "_fmtBySrv": null,
          "v": "20050127"
        },
        "BA3": {
          "v": "2005-01-27-04-4"
        },
        "BA4": {
          "v": "1"
        },
        "BA5": {
          "v": "1"
        },
        "BA6": {
          "v": "1"
        },
        "BA7": {
          "v": "0"
        },
        "BA8": {
          "v": "0"
        }
      },
      "BA2": "01/27/05",
      "BA3": "2005-01-27-04-4",
      "BA4": "1",
      "BA5": "1",
      "BA6": "1",
      "BA7": "0",
      "BA8": "0"
    },
    {
      "$uuid": 27,
      "$serverIndex": 27,
      "$rawV": {
        "BA2": {
          "fmt": null,
          "_fmtBySrv": null,
          "v": "20050128"
        },
        "BA3": {
          "v": "2005-01-28-04-5"
        },
        "BA4": {
          "v": "1"
        },
        "BA5": {
          "v": "1"
        },
        "BA6": {
          "v": "1"
        },
        "BA7": {
          "v": "0"
        },
        "BA8": {
          "v": "0"
        }
      },
      "BA2": "01/28/05",
      "BA3": "2005-01-28-04-5",
      "BA4": "1",
      "BA5": "1",
      "BA6": "1",
      "BA7": "0",
      "BA8": "0"
    },
    {
      "$uuid": 28,
      "$serverIndex": 28,
      "$rawV": {
        "BA2": {
          "fmt": null,
          "_fmtBySrv": null,
          "v": "20050129"
        },
        "BA3": {
          "v": "2005-01-29-04-6"
        },
        "BA4": {
          "v": "2"
        },
        "BA5": {
          "v": "0"
        },
        "BA6": {
          "v": "0"
        },
        "BA7": {
          "v": "0"
        },
        "BA8": {
          "v": "0"
        }
      },
      "BA2": "01/29/05",
      "BA3": "2005-01-29-04-6",
      "BA4": "2",
      "BA5": "0",
      "BA6": "0",
      "BA7": "0",
      "BA8": "0"
    },
    {
      "$uuid": 29,
      "$serverIndex": 29,
      "$rawV": {
        "BA2": {
          "fmt": null,
          "_fmtBySrv": null,
          "v": "20050130"
        },
        "BA3": {
          "v": "2005-01-30-04-7"
        },
        "BA4": {
          "v": "2"
        },
        "BA5": {
          "v": "0"
        },
        "BA6": {
          "v": "0"
        },
        "BA7": {
          "v": "0"
        },
        "BA8": {
          "v": "0"
        }
      },
      "BA2": "01/30/05",
      "BA3": "2005-01-30-04-7",
      "BA4": "2",
      "BA5": "0",
      "BA6": "0",
      "BA7": "0",
      "BA8": "0"
    },
    {
      "$uuid": 30,
      "$serverIndex": 30,
      "$rawV": {
        "BA2": {
          "fmt": null,
          "_fmtBySrv": null,
          "v": "20050131"
        },
        "BA3": {
          "v": "2005-01-31-05-1"
        },
        "BA4": {
          "v": "1"
        },
        "BA5": {
          "v": "1"
        },
        "BA6": {
          "v": "1"
        },
        "BA7": {
          "v": "0"
        },
        "BA8": {
          "v": "0"
        }
      },
      "BA2": "01/31/05",
      "BA3": "2005-01-31-05-1",
      "BA4": "1",
      "BA5": "1",
      "BA6": "1",
      "BA7": "0",
      "BA8": "0"
    },
    {
      "$uuid": 31,
      "$serverIndex": 31,
      "$rawV": {
        "BA2": {
          "fmt": null,
          "_fmtBySrv": null,
          "v": "20050201"
        },
        "BA3": {
          "v": "2005-02-01-05-2"
        },
        "BA4": {
          "v": "1"
        },
        "BA5": {
          "v": "1"
        },
        "BA6": {
          "v": "1"
        },
        "BA7": {
          "v": "0"
        },
        "BA8": {
          "v": "0"
        }
      },
      "BA2": "02/01/05",
      "BA3": "2005-02-01-05-2",
      "BA4": "1",
      "BA5": "1",
      "BA6": "1",
      "BA7": "0",
      "BA8": "0"
    },
    {
      "$uuid": 32,
      "$serverIndex": 32,
      "$rawV": {
        "BA2": {
          "fmt": null,
          "_fmtBySrv": null,
          "v": "20050202"
        },
        "BA3": {
          "v": "2005-02-02-05-3"
        },
        "BA4": {
          "v": "1"
        },
        "BA5": {
          "v": "1"
        },
        "BA6": {
          "v": "1"
        },
        "BA7": {
          "v": "0"
        },
        "BA8": {
          "v": "0"
        }
      },
      "BA2": "02/02/05",
      "BA3": "2005-02-02-05-3",
      "BA4": "1",
      "BA5": "1",
      "BA6": "1",
      "BA7": "0",
      "BA8": "0"
    },
    {
      "$uuid": 33,
      "$serverIndex": 33,
      "$rawV": {
        "BA2": {
          "fmt": null,
          "_fmtBySrv": null,
          "v": "20050203"
        },
        "BA3": {
          "v": "2005-02-03-05-4"
        },
        "BA4": {
          "v": "1"
        },
        "BA5": {
          "v": "1"
        },
        "BA6": {
          "v": "1"
        },
        "BA7": {
          "v": "0"
        },
        "BA8": {
          "v": "0"
        }
      },
      "BA2": "02/03/05",
      "BA3": "2005-02-03-05-4",
      "BA4": "1",
      "BA5": "1",
      "BA6": "1",
      "BA7": "0",
      "BA8": "0"
    },
    {
      "$uuid": 34,
      "$serverIndex": 34,
      "$rawV": {
        "BA2": {
          "fmt": null,
          "_fmtBySrv": null,
          "v": "20050204"
        },
        "BA3": {
          "v": "2005-02-04-05-5"
        },
        "BA4": {
          "v": "1"
        },
        "BA5": {
          "v": "1"
        },
        "BA6": {
          "v": "1"
        },
        "BA7": {
          "v": "0"
        },
        "BA8": {
          "v": "0"
        }
      },
      "BA2": "02/04/05",
      "BA3": "2005-02-04-05-5",
      "BA4": "1",
      "BA5": "1",
      "BA6": "1",
      "BA7": "0",
      "BA8": "0"
    },
    {
      "$uuid": 35,
      "$serverIndex": 35,
      "$rawV": {
        "BA2": {
          "fmt": null,
          "_fmtBySrv": null,
          "v": "20050205"
        },
        "BA3": {
          "v": "2005-02-05-05-6"
        },
        "BA4": {
          "v": "2"
        },
        "BA5": {
          "v": "0"
        },
        "BA6": {
          "v": "0"
        },
        "BA7": {
          "v": "0"
        },
        "BA8": {
          "v": "0"
        }
      },
      "BA2": "02/05/05",
      "BA3": "2005-02-05-05-6",
      "BA4": "2",
      "BA5": "0",
      "BA6": "0",
      "BA7": "0",
      "BA8": "0"
    },
    {
      "$uuid": 36,
      "$serverIndex": 36,
      "$rawV": {
        "BA2": {
          "fmt": null,
          "_fmtBySrv": null,
          "v": "20050206"
        },
        "BA3": {
          "v": "2005-02-06-05-7"
        },
        "BA4": {
          "v": "2"
        },
        "BA5": {
          "v": "0"
        },
        "BA6": {
          "v": "0"
        },
        "BA7": {
          "v": "0"
        },
        "BA8": {
          "v": "0"
        }
      },
      "BA2": "02/06/05",
      "BA3": "2005-02-06-05-7",
      "BA4": "2",
      "BA5": "0",
      "BA6": "0",
      "BA7": "0",
      "BA8": "0"
    },
    {
      "$uuid": 37,
      "$serverIndex": 37,
      "$rawV": {
        "BA2": {
          "fmt": null,
          "_fmtBySrv": null,
          "v": "20050207"
        },
        "BA3": {
          "v": "2005-02-07-06-1"
        },
        "BA4": {
          "v": "1"
        },
        "BA5": {
          "v": "1"
        },
        "BA6": {
          "v": "1"
        },
        "BA7": {
          "v": "0"
        },
        "BA8": {
          "v": "0"
        }
      },
      "BA2": "02/07/05",
      "BA3": "2005-02-07-06-1",
      "BA4": "1",
      "BA5": "1",
      "BA6": "1",
      "BA7": "0",
      "BA8": "0"
    },
    {
      "$uuid": 38,
      "$serverIndex": 38,
      "$rawV": {
        "BA2": {
          "fmt": null,
          "_fmtBySrv": null,
          "v": "20050208"
        },
        "BA3": {
          "v": "2005-02-08-06-2"
        },
        "BA4": {
          "v": "1"
        },
        "BA5": {
          "v": "1"
        },
        "BA6": {
          "v": "1"
        },
        "BA7": {
          "v": "0"
        },
        "BA8": {
          "v": "0"
        }
      },
      "BA2": "02/08/05",
      "BA3": "2005-02-08-06-2",
      "BA4": "1",
      "BA5": "1",
      "BA6": "1",
      "BA7": "0",
      "BA8": "0"
    },
    {
      "$uuid": 39,
      "$serverIndex": 39,
      "$rawV": {
        "BA2": {
          "fmt": null,
          "_fmtBySrv": null,
          "v": "20050209"
        },
        "BA3": {
          "v": "2005-02-09-06-3"
        },
        "BA4": {
          "v": "1"
        },
        "BA5": {
          "v": "1"
        },
        "BA6": {
          "v": "1"
        },
        "BA7": {
          "v": "0"
        },
        "BA8": {
          "v": "0"
        }
      },
      "BA2": "02/09/05",
      "BA3": "2005-02-09-06-3",
      "BA4": "1",
      "BA5": "1",
      "BA6": "1",
      "BA7": "0",
      "BA8": "0"
    },
    {
      "$uuid": 40,
      "$serverIndex": 40,
      "$rawV": {
        "BA2": {
          "fmt": null,
          "_fmtBySrv": null,
          "v": "20050210"
        },
        "BA3": {
          "v": "2005-02-10-06-4"
        },
        "BA4": {
          "v": "1"
        },
        "BA5": {
          "v": "1"
        },
        "BA6": {
          "v": "1"
        },
        "BA7": {
          "v": "0"
        },
        "BA8": {
          "v": "0"
        }
      },
      "BA2": "02/10/05",
      "BA3": "2005-02-10-06-4",
      "BA4": "1",
      "BA5": "1",
      "BA6": "1",
      "BA7": "0",
      "BA8": "0"
    },
    {
      "$uuid": 41,
      "$serverIndex": 41,
      "$rawV": {
        "BA2": {
          "fmt": null,
          "_fmtBySrv": null,
          "v": "20050211"
        },
        "BA3": {
          "v": "2005-02-11-06-5"
        },
        "BA4": {
          "v": "1"
        },
        "BA5": {
          "v": "1"
        },
        "BA6": {
          "v": "1"
        },
        "BA7": {
          "v": "0"
        },
        "BA8": {
          "v": "0"
        }
      },
      "BA2": "02/11/05",
      "BA3": "2005-02-11-06-5",
      "BA4": "1",
      "BA5": "1",
      "BA6": "1",
      "BA7": "0",
      "BA8": "0"
    },
    {
      "$uuid": 42,
      "$serverIndex": 42,
      "$rawV": {
        "BA2": {
          "fmt": null,
          "_fmtBySrv": null,
          "v": "20050212"
        },
        "BA3": {
          "v": "2005-02-12-06-6"
        },
        "BA4": {
          "v": "2"
        },
        "BA5": {
          "v": "0"
        },
        "BA6": {
          "v": "0"
        },
        "BA7": {
          "v": "0"
        },
        "BA8": {
          "v": "0"
        }
      },
      "BA2": "02/12/05",
      "BA3": "2005-02-12-06-6",
      "BA4": "2",
      "BA5": "0",
      "BA6": "0",
      "BA7": "0",
      "BA8": "0"
    },
    {
      "$uuid": 43,
      "$serverIndex": 43,
      "$rawV": {
        "BA2": {
          "fmt": null,
          "_fmtBySrv": null,
          "v": "20050213"
        },
        "BA3": {
          "v": "2005-02-13-06-7"
        },
        "BA4": {
          "v": "2"
        },
        "BA5": {
          "v": "0"
        },
        "BA6": {
          "v": "0"
        },
        "BA7": {
          "v": "0"
        },
        "BA8": {
          "v": "0"
        }
      },
      "BA2": "02/13/05",
      "BA3": "2005-02-13-06-7",
      "BA4": "2",
      "BA5": "0",
      "BA6": "0",
      "BA7": "0",
      "BA8": "0"
    },
    {
      "$uuid": 44,
      "$serverIndex": 44,
      "$rawV": {
        "BA2": {
          "fmt": null,
          "_fmtBySrv": null,
          "v": "20050214"
        },
        "BA3": {
          "v": "2005-02-14-07-1"
        },
        "BA4": {
          "v": "1"
        },
        "BA5": {
          "v": "1"
        },
        "BA6": {
          "v": "1"
        },
        "BA7": {
          "v": "0"
        },
        "BA8": {
          "v": "0"
        }
      },
      "BA2": "02/14/05",
      "BA3": "2005-02-14-07-1",
      "BA4": "1",
      "BA5": "1",
      "BA6": "1",
      "BA7": "0",
      "BA8": "0"
    },
    {
      "$uuid": 45,
      "$serverIndex": 45,
      "$rawV": {
        "BA2": {
          "fmt": null,
          "_fmtBySrv": null,
          "v": "20050215"
        },
        "BA3": {
          "v": "2005-02-15-07-2"
        },
        "BA4": {
          "v": "1"
        },
        "BA5": {
          "v": "1"
        },
        "BA6": {
          "v": "1"
        },
        "BA7": {
          "v": "0"
        },
        "BA8": {
          "v": "0"
        }
      },
      "BA2": "02/15/05",
      "BA3": "2005-02-15-07-2",
      "BA4": "1",
      "BA5": "1",
      "BA6": "1",
      "BA7": "0",
      "BA8": "0"
    },
    {
      "$uuid": 46,
      "$serverIndex": 46,
      "$rawV": {
        "BA2": {
          "fmt": null,
          "_fmtBySrv": null,
          "v": "20050216"
        },
        "BA3": {
          "v": "2005-02-16-07-3"
        },
        "BA4": {
          "v": "1"
        },
        "BA5": {
          "v": "1"
        },
        "BA6": {
          "v": "1"
        },
        "BA7": {
          "v": "0"
        },
        "BA8": {
          "v": "0"
        }
      },
      "BA2": "02/16/05",
      "BA3": "2005-02-16-07-3",
      "BA4": "1",
      "BA5": "1",
      "BA6": "1",
      "BA7": "0",
      "BA8": "0"
    },
    {
      "$uuid": 47,
      "$serverIndex": 47,
      "$rawV": {
        "BA2": {
          "fmt": null,
          "_fmtBySrv": null,
          "v": "20050217"
        },
        "BA3": {
          "v": "2005-02-17-07-4"
        },
        "BA4": {
          "v": "1"
        },
        "BA5": {
          "v": "1"
        },
        "BA6": {
          "v": "1"
        },
        "BA7": {
          "v": "0"
        },
        "BA8": {
          "v": "0"
        }
      },
      "BA2": "02/17/05",
      "BA3": "2005-02-17-07-4",
      "BA4": "1",
      "BA5": "1",
      "BA6": "1",
      "BA7": "0",
      "BA8": "0"
    },
    {
      "$uuid": 48,
      "$serverIndex": 48,
      "$rawV": {
        "BA2": {
          "fmt": null,
          "_fmtBySrv": null,
          "v": "20050218"
        },
        "BA3": {
          "v": "2005-02-18-07-5"
        },
        "BA4": {
          "v": "1"
        },
        "BA5": {
          "v": "1"
        },
        "BA6": {
          "v": "1"
        },
        "BA7": {
          "v": "0"
        },
        "BA8": {
          "v": "0"
        }
      },
      "BA2": "02/18/05",
      "BA3": "2005-02-18-07-5",
      "BA4": "1",
      "BA5": "1",
      "BA6": "1",
      "BA7": "0",
      "BA8": "0"
    },
    {
      "$uuid": 49,
      "$serverIndex": 49,
      "$rawV": {
        "BA2": {
          "fmt": null,
          "_fmtBySrv": null,
          "v": "20050219"
        },
        "BA3": {
          "v": "2005-02-19-07-6"
        },
        "BA4": {
          "v": "2"
        },
        "BA5": {
          "v": "0"
        },
        "BA6": {
          "v": "0"
        },
        "BA7": {
          "v": "0"
        },
        "BA8": {
          "v": "0"
        }
      },
      "BA2": "02/19/05",
      "BA3": "2005-02-19-07-6",
      "BA4": "2",
      "BA5": "0",
      "BA6": "0",
      "BA7": "0",
      "BA8": "0"
    },
    {
      "$uuid": 50,
      "$serverIndex": 50,
      "$rawV": {
        "BA2": {
          "fmt": null,
          "_fmtBySrv": null,
          "v": "20050220"
        },
        "BA3": {
          "v": "2005-02-20-07-7"
        },
        "BA4": {
          "v": "2"
        },
        "BA5": {
          "v": "0"
        },
        "BA6": {
          "v": "0"
        },
        "BA7": {
          "v": "0"
        },
        "BA8": {
          "v": "0"
        }
      },
      "BA2": "02/20/05",
      "BA3": "2005-02-20-07-7",
      "BA4": "2",
      "BA5": "0",
      "BA6": "0",
      "BA7": "0",
      "BA8": "0"
    },
    {
      "$uuid": 51,
      "$serverIndex": 51,
      "$rawV": {
        "BA2": {
          "fmt": null,
          "_fmtBySrv": null,
          "v": "20050221"
        },
        "BA3": {
          "v": "2005-02-21-08-1"
        },
        "BA4": {
          "v": "1"
        },
        "BA5": {
          "v": "1"
        },
        "BA6": {
          "v": "1"
        },
        "BA7": {
          "v": "0"
        },
        "BA8": {
          "v": "0"
        }
      },
      "BA2": "02/21/05",
      "BA3": "2005-02-21-08-1",
      "BA4": "1",
      "BA5": "1",
      "BA6": "1",
      "BA7": "0",
      "BA8": "0"
    },
    {
      "$uuid": 52,
      "$serverIndex": 52,
      "$rawV": {
        "BA2": {
          "fmt": null,
          "_fmtBySrv": null,
          "v": "20050222"
        },
        "BA3": {
          "v": "2005-02-22-08-2"
        },
        "BA4": {
          "v": "1"
        },
        "BA5": {
          "v": "1"
        },
        "BA6": {
          "v": "1"
        },
        "BA7": {
          "v": "0"
        },
        "BA8": {
          "v": "0"
        }
      },
      "BA2": "02/22/05",
      "BA3": "2005-02-22-08-2",
      "BA4": "1",
      "BA5": "1",
      "BA6": "1",
      "BA7": "0",
      "BA8": "0"
    },
    {
      "$uuid": 53,
      "$serverIndex": 53,
      "$rawV": {
        "BA2": {
          "fmt": null,
          "_fmtBySrv": null,
          "v": "20050223"
        },
        "BA3": {
          "v": "2005-02-23-08-3"
        },
        "BA4": {
          "v": "1"
        },
        "BA5": {
          "v": "1"
        },
        "BA6": {
          "v": "1"
        },
        "BA7": {
          "v": "0"
        },
        "BA8": {
          "v": "0"
        }
      },
      "BA2": "02/23/05",
      "BA3": "2005-02-23-08-3",
      "BA4": "1",
      "BA5": "1",
      "BA6": "1",
      "BA7": "0",
      "BA8": "0"
    },
    {
      "$uuid": 54,
      "$serverIndex": 54,
      "$rawV": {
        "BA2": {
          "fmt": null,
          "_fmtBySrv": null,
          "v": "20050224"
        },
        "BA3": {
          "v": "2005-02-24-08-4"
        },
        "BA4": {
          "v": "1"
        },
        "BA5": {
          "v": "1"
        },
        "BA6": {
          "v": "1"
        },
        "BA7": {
          "v": "0"
        },
        "BA8": {
          "v": "0"
        }
      },
      "BA2": "02/24/05",
      "BA3": "2005-02-24-08-4",
      "BA4": "1",
      "BA5": "1",
      "BA6": "1",
      "BA7": "0",
      "BA8": "0"
    },
    {
      "$uuid": 55,
      "$serverIndex": 55,
      "$rawV": {
        "BA2": {
          "fmt": null,
          "_fmtBySrv": null,
          "v": "20050225"
        },
        "BA3": {
          "v": "2005-02-25-08-5"
        },
        "BA4": {
          "v": "1"
        },
        "BA5": {
          "v": "1"
        },
        "BA6": {
          "v": "1"
        },
        "BA7": {
          "v": "0"
        },
        "BA8": {
          "v": "0"
        }
      },
      "BA2": "02/25/05",
      "BA3": "2005-02-25-08-5",
      "BA4": "1",
      "BA5": "1",
      "BA6": "1",
      "BA7": "0",
      "BA8": "0"
    },
    {
      "$uuid": 56,
      "$serverIndex": 56,
      "$rawV": {
        "BA2": {
          "fmt": null,
          "_fmtBySrv": null,
          "v": "20050226"
        },
        "BA3": {
          "v": "2005-02-26-08-6"
        },
        "BA4": {
          "v": "2"
        },
        "BA5": {
          "v": "0"
        },
        "BA6": {
          "v": "0"
        },
        "BA7": {
          "v": "0"
        },
        "BA8": {
          "v": "0"
        }
      },
      "BA2": "02/26/05",
      "BA3": "2005-02-26-08-6",
      "BA4": "2",
      "BA5": "0",
      "BA6": "0",
      "BA7": "0",
      "BA8": "0"
    },
    {
      "$uuid": 57,
      "$serverIndex": 57,
      "$rawV": {
        "BA2": {
          "fmt": null,
          "_fmtBySrv": null,
          "v": "20050227"
        },
        "BA3": {
          "v": "2005-02-27-08-7"
        },
        "BA4": {
          "v": "2"
        },
        "BA5": {
          "v": "0"
        },
        "BA6": {
          "v": "0"
        },
        "BA7": {
          "v": "0"
        },
        "BA8": {
          "v": "0"
        }
      },
      "BA2": "02/27/05",
      "BA3": "2005-02-27-08-7",
      "BA4": "2",
      "BA5": "0",
      "BA6": "0",
      "BA7": "0",
      "BA8": "0"
    },
    {
      "$uuid": 58,
      "$serverIndex": 58,
      "$rawV": {
        "BA2": {
          "fmt": null,
          "_fmtBySrv": null,
          "v": "20050228"
        },
        "BA3": {
          "v": "2005-02-28-09-1"
        },
        "BA4": {
          "v": "1"
        },
        "BA5": {
          "v": "1"
        },
        "BA6": {
          "v": "1"
        },
        "BA7": {
          "v": "0"
        },
        "BA8": {
          "v": "0"
        }
      },
      "BA2": "02/28/05",
      "BA3": "2005-02-28-09-1",
      "BA4": "1",
      "BA5": "1",
      "BA6": "1",
      "BA7": "0",
      "BA8": "0"
    },
    {
      "$uuid": 59,
      "$serverIndex": 59,
      "$rawV": {
        "BA2": {
          "fmt": null,
          "_fmtBySrv": null,
          "v": "20050301"
        },
        "BA3": {
          "v": "2005-03-01-09-2"
        },
        "BA4": {
          "v": "1"
        },
        "BA5": {
          "v": "1"
        },
        "BA6": {
          "v": "1"
        },
        "BA7": {
          "v": "0"
        },
        "BA8": {
          "v": "0"
        }
      },
      "BA2": "03/01/05",
      "BA3": "2005-03-01-09-2",
      "BA4": "1",
      "BA5": "1",
      "BA6": "1",
      "BA7": "0",
      "BA8": "0"
    },
    {
      "$uuid": 60,
      "$serverIndex": 60,
      "$rawV": {
        "BA2": {
          "fmt": null,
          "_fmtBySrv": null,
          "v": "20050302"
        },
        "BA3": {
          "v": "2005-03-02-09-3"
        },
        "BA4": {
          "v": "1"
        },
        "BA5": {
          "v": "1"
        },
        "BA6": {
          "v": "1"
        },
        "BA7": {
          "v": "0"
        },
        "BA8": {
          "v": "0"
        }
      },
      "BA2": "03/02/05",
      "BA3": "2005-03-02-09-3",
      "BA4": "1",
      "BA5": "1",
      "BA6": "1",
      "BA7": "0",
      "BA8": "0"
    },
    {
      "$uuid": 61,
      "$serverIndex": 61,
      "$rawV": {
        "BA2": {
          "fmt": null,
          "_fmtBySrv": null,
          "v": "20050303"
        },
        "BA3": {
          "v": "2005-03-03-09-4"
        },
        "BA4": {
          "v": "1"
        },
        "BA5": {
          "v": "1"
        },
        "BA6": {
          "v": "1"
        },
        "BA7": {
          "v": "0"
        },
        "BA8": {
          "v": "0"
        }
      },
      "BA2": "03/03/05",
      "BA3": "2005-03-03-09-4",
      "BA4": "1",
      "BA5": "1",
      "BA6": "1",
      "BA7": "0",
      "BA8": "0"
    },
    {
      "$uuid": 62,
      "$serverIndex": 62,
      "$rawV": {
        "BA2": {
          "fmt": null,
          "_fmtBySrv": null,
          "v": "20050304"
        },
        "BA3": {
          "v": "2005-03-04-09-5"
        },
        "BA4": {
          "v": "1"
        },
        "BA5": {
          "v": "1"
        },
        "BA6": {
          "v": "1"
        },
        "BA7": {
          "v": "0"
        },
        "BA8": {
          "v": "0"
        }
      },
      "BA2": "03/04/05",
      "BA3": "2005-03-04-09-5",
      "BA4": "1",
      "BA5": "1",
      "BA6": "1",
      "BA7": "0",
      "BA8": "0"
    },
    {
      "$uuid": 63,
      "$serverIndex": 63,
      "$rawV": {
        "BA2": {
          "fmt": null,
          "_fmtBySrv": null,
          "v": "20050305"
        },
        "BA3": {
          "v": "2005-03-05-09-6"
        },
        "BA4": {
          "v": "2"
        },
        "BA5": {
          "v": "0"
        },
        "BA6": {
          "v": "0"
        },
        "BA7": {
          "v": "0"
        },
        "BA8": {
          "v": "0"
        }
      },
      "BA2": "03/05/05",
      "BA3": "2005-03-05-09-6",
      "BA4": "2",
      "BA5": "0",
      "BA6": "0",
      "BA7": "0",
      "BA8": "0"
    },
    {
      "$uuid": 64,
      "$serverIndex": 64,
      "$rawV": {
        "BA2": {
          "fmt": null,
          "_fmtBySrv": null,
          "v": "20050306"
        },
        "BA3": {
          "v": "2005-03-06-09-7"
        },
        "BA4": {
          "v": "2"
        },
        "BA5": {
          "v": "0"
        },
        "BA6": {
          "v": "0"
        },
        "BA7": {
          "v": "0"
        },
        "BA8": {
          "v": "0"
        }
      },
      "BA2": "03/06/05",
      "BA3": "2005-03-06-09-7",
      "BA4": "2",
      "BA5": "0",
      "BA6": "0",
      "BA7": "0",
      "BA8": "0"
    },
    {
      "$uuid": 65,
      "$serverIndex": 65,
      "$rawV": {
        "BA2": {
          "fmt": null,
          "_fmtBySrv": null,
          "v": "20050307"
        },
        "BA3": {
          "v": "2005-03-07-10-1"
        },
        "BA4": {
          "v": "1"
        },
        "BA5": {
          "v": "1"
        },
        "BA6": {
          "v": "1"
        },
        "BA7": {
          "v": "0"
        },
        "BA8": {
          "v": "0"
        }
      },
      "BA2": "03/07/05",
      "BA3": "2005-03-07-10-1",
      "BA4": "1",
      "BA5": "1",
      "BA6": "1",
      "BA7": "0",
      "BA8": "0"
    },
    {
      "$uuid": 66,
      "$serverIndex": 66,
      "$rawV": {
        "BA2": {
          "fmt": null,
          "_fmtBySrv": null,
          "v": "20050308"
        },
        "BA3": {
          "v": "2005-03-08-10-2"
        },
        "BA4": {
          "v": "1"
        },
        "BA5": {
          "v": "1"
        },
        "BA6": {
          "v": "1"
        },
        "BA7": {
          "v": "0"
        },
        "BA8": {
          "v": "0"
        }
      },
      "BA2": "03/08/05",
      "BA3": "2005-03-08-10-2",
      "BA4": "1",
      "BA5": "1",
      "BA6": "1",
      "BA7": "0",
      "BA8": "0"
    },
    {
      "$uuid": 67,
      "$serverIndex": 67,
      "$rawV": {
        "BA2": {
          "fmt": null,
          "_fmtBySrv": null,
          "v": "20050309"
        },
        "BA3": {
          "v": "2005-03-09-10-3"
        },
        "BA4": {
          "v": "1"
        },
        "BA5": {
          "v": "1"
        },
        "BA6": {
          "v": "1"
        },
        "BA7": {
          "v": "0"
        },
        "BA8": {
          "v": "0"
        }
      },
      "BA2": "03/09/05",
      "BA3": "2005-03-09-10-3",
      "BA4": "1",
      "BA5": "1",
      "BA6": "1",
      "BA7": "0",
      "BA8": "0"
    },
    {
      "$uuid": 68,
      "$serverIndex": 68,
      "$rawV": {
        "BA2": {
          "fmt": null,
          "_fmtBySrv": null,
          "v": "20050310"
        },
        "BA3": {
          "v": "2005-03-10-10-4"
        },
        "BA4": {
          "v": "1"
        },
        "BA5": {
          "v": "1"
        },
        "BA6": {
          "v": "1"
        },
        "BA7": {
          "v": "0"
        },
        "BA8": {
          "v": "0"
        }
      },
      "BA2": "03/10/05",
      "BA3": "2005-03-10-10-4",
      "BA4": "1",
      "BA5": "1",
      "BA6": "1",
      "BA7": "0",
      "BA8": "0"
    },
    {
      "$uuid": 69,
      "$serverIndex": 69,
      "$rawV": {
        "BA2": {
          "fmt": null,
          "_fmtBySrv": null,
          "v": "20050311"
        },
        "BA3": {
          "v": "2005-03-11-10-5"
        },
        "BA4": {
          "v": "1"
        },
        "BA5": {
          "v": "1"
        },
        "BA6": {
          "v": "1"
        },
        "BA7": {
          "v": "0"
        },
        "BA8": {
          "v": "0"
        }
      },
      "BA2": "03/11/05",
      "BA3": "2005-03-11-10-5",
      "BA4": "1",
      "BA5": "1",
      "BA6": "1",
      "BA7": "0",
      "BA8": "0"
    },
    {
      "$uuid": 70,
      "$serverIndex": 70,
      "$rawV": {
        "BA2": {
          "fmt": null,
          "_fmtBySrv": null,
          "v": "20050312"
        },
        "BA3": {
          "v": "2005-03-12-10-6"
        },
        "BA4": {
          "v": "2"
        },
        "BA5": {
          "v": "0"
        },
        "BA6": {
          "v": "0"
        },
        "BA7": {
          "v": "0"
        },
        "BA8": {
          "v": "0"
        }
      },
      "BA2": "03/12/05",
      "BA3": "2005-03-12-10-6",
      "BA4": "2",
      "BA5": "0",
      "BA6": "0",
      "BA7": "0",
      "BA8": "0"
    },
    {
      "$uuid": 71,
      "$serverIndex": 71,
      "$rawV": {
        "BA2": {
          "fmt": null,
          "_fmtBySrv": null,
          "v": "20050313"
        },
        "BA3": {
          "v": "2005-03-13-10-7"
        },
        "BA4": {
          "v": "2"
        },
        "BA5": {
          "v": "0"
        },
        "BA6": {
          "v": "0"
        },
        "BA7": {
          "v": "0"
        },
        "BA8": {
          "v": "0"
        }
      },
      "BA2": "03/13/05",
      "BA3": "2005-03-13-10-7",
      "BA4": "2",
      "BA5": "0",
      "BA6": "0",
      "BA7": "0",
      "BA8": "0"
    },
    {
      "$uuid": 72,
      "$serverIndex": 72,
      "$rawV": {
        "BA2": {
          "fmt": null,
          "_fmtBySrv": null,
          "v": "20050314"
        },
        "BA3": {
          "v": "2005-03-14-11-1"
        },
        "BA4": {
          "v": "1"
        },
        "BA5": {
          "v": "1"
        },
        "BA6": {
          "v": "1"
        },
        "BA7": {
          "v": "0"
        },
        "BA8": {
          "v": "0"
        }
      },
      "BA2": "03/14/05",
      "BA3": "2005-03-14-11-1",
      "BA4": "1",
      "BA5": "1",
      "BA6": "1",
      "BA7": "0",
      "BA8": "0"
    },
    {
      "$uuid": 73,
      "$serverIndex": 73,
      "$rawV": {
        "BA2": {
          "fmt": null,
          "_fmtBySrv": null,
          "v": "20050315"
        },
        "BA3": {
          "v": "2005-03-15-11-2"
        },
        "BA4": {
          "v": "1"
        },
        "BA5": {
          "v": "1"
        },
        "BA6": {
          "v": "1"
        },
        "BA7": {
          "v": "0"
        },
        "BA8": {
          "v": "0"
        }
      },
      "BA2": "03/15/05",
      "BA3": "2005-03-15-11-2",
      "BA4": "1",
      "BA5": "1",
      "BA6": "1",
      "BA7": "0",
      "BA8": "0"
    },
    {
      "$uuid": 74,
      "$serverIndex": 74,
      "$rawV": {
        "BA2": {
          "fmt": null,
          "_fmtBySrv": null,
          "v": "20050316"
        },
        "BA3": {
          "v": "2005-03-16-11-3"
        },
        "BA4": {
          "v": "1"
        },
        "BA5": {
          "v": "1"
        },
        "BA6": {
          "v": "1"
        },
        "BA7": {
          "v": "0"
        },
        "BA8": {
          "v": "0"
        }
      },
      "BA2": "03/16/05",
      "BA3": "2005-03-16-11-3",
      "BA4": "1",
      "BA5": "1",
      "BA6": "1",
      "BA7": "0",
      "BA8": "0"
    },
    {
      "$uuid": 75,
      "$serverIndex": 75,
      "$rawV": {
        "BA2": {
          "fmt": null,
          "_fmtBySrv": null,
          "v": "20050317"
        },
        "BA3": {
          "v": "2005-03-17-11-4"
        },
        "BA4": {
          "v": "1"
        },
        "BA5": {
          "v": "1"
        },
        "BA6": {
          "v": "1"
        },
        "BA7": {
          "v": "0"
        },
        "BA8": {
          "v": "0"
        }
      },
      "BA2": "03/17/05",
      "BA3": "2005-03-17-11-4",
      "BA4": "1",
      "BA5": "1",
      "BA6": "1",
      "BA7": "0",
      "BA8": "0"
    },
    {
      "$uuid": 76,
      "$serverIndex": 76,
      "$rawV": {
        "BA2": {
          "fmt": null,
          "_fmtBySrv": null,
          "v": "20050318"
        },
        "BA3": {
          "v": "2005-03-18-11-5"
        },
        "BA4": {
          "v": "1"
        },
        "BA5": {
          "v": "1"
        },
        "BA6": {
          "v": "1"
        },
        "BA7": {
          "v": "0"
        },
        "BA8": {
          "v": "0"
        }
      },
      "BA2": "03/18/05",
      "BA3": "2005-03-18-11-5",
      "BA4": "1",
      "BA5": "1",
      "BA6": "1",
      "BA7": "0",
      "BA8": "0"
    },
    {
      "$uuid": 77,
      "$serverIndex": 77,
      "$rawV": {
        "BA2": {
          "fmt": null,
          "_fmtBySrv": null,
          "v": "20050319"
        },
        "BA3": {
          "v": "2005-03-19-11-6"
        },
        "BA4": {
          "v": "2"
        },
        "BA5": {
          "v": "0"
        },
        "BA6": {
          "v": "0"
        },
        "BA7": {
          "v": "0"
        },
        "BA8": {
          "v": "0"
        }
      },
      "BA2": "03/19/05",
      "BA3": "2005-03-19-11-6",
      "BA4": "2",
      "BA5": "0",
      "BA6": "0",
      "BA7": "0",
      "BA8": "0"
    },
    {
      "$uuid": 78,
      "$serverIndex": 78,
      "$rawV": {
        "BA2": {
          "fmt": null,
          "_fmtBySrv": null,
          "v": "20050320"
        },
        "BA3": {
          "v": "2005-03-20-11-7"
        },
        "BA4": {
          "v": "2"
        },
        "BA5": {
          "v": "0"
        },
        "BA6": {
          "v": "0"
        },
        "BA7": {
          "v": "0"
        },
        "BA8": {
          "v": "0"
        }
      },
      "BA2": "03/20/05",
      "BA3": "2005-03-20-11-7",
      "BA4": "2",
      "BA5": "0",
      "BA6": "0",
      "BA7": "0",
      "BA8": "0"
    },
    {
      "$uuid": 79,
      "$serverIndex": 79,
      "$rawV": {
        "BA2": {
          "fmt": null,
          "_fmtBySrv": null,
          "v": "20050321"
        },
        "BA3": {
          "v": "2005-03-21-12-1"
        },
        "BA4": {
          "v": "1"
        },
        "BA5": {
          "v": "1"
        },
        "BA6": {
          "v": "1"
        },
        "BA7": {
          "v": "0"
        },
        "BA8": {
          "v": "0"
        }
      },
      "BA2": "03/21/05",
      "BA3": "2005-03-21-12-1",
      "BA4": "1",
      "BA5": "1",
      "BA6": "1",
      "BA7": "0",
      "BA8": "0"
    },
    {
      "$uuid": 80,
      "$serverIndex": 80,
      "$rawV": {
        "BA2": {
          "fmt": null,
          "_fmtBySrv": null,
          "v": "20050322"
        },
        "BA3": {
          "v": "2005-03-22-12-2"
        },
        "BA4": {
          "v": "1"
        },
        "BA5": {
          "v": "1"
        },
        "BA6": {
          "v": "1"
        },
        "BA7": {
          "v": "0"
        },
        "BA8": {
          "v": "0"
        }
      },
      "BA2": "03/22/05",
      "BA3": "2005-03-22-12-2",
      "BA4": "1",
      "BA5": "1",
      "BA6": "1",
      "BA7": "0",
      "BA8": "0"
    },
    {
      "$uuid": 81,
      "$serverIndex": 81,
      "$rawV": {
        "BA2": {
          "fmt": null,
          "_fmtBySrv": null,
          "v": "20050323"
        },
        "BA3": {
          "v": "2005-03-23-12-3"
        },
        "BA4": {
          "v": "1"
        },
        "BA5": {
          "v": "1"
        },
        "BA6": {
          "v": "1"
        },
        "BA7": {
          "v": "0"
        },
        "BA8": {
          "v": "0"
        }
      },
      "BA2": "03/23/05",
      "BA3": "2005-03-23-12-3",
      "BA4": "1",
      "BA5": "1",
      "BA6": "1",
      "BA7": "0",
      "BA8": "0"
    },
    {
      "$uuid": 82,
      "$serverIndex": 82,
      "$rawV": {
        "BA2": {
          "fmt": null,
          "_fmtBySrv": null,
          "v": "20050324"
        },
        "BA3": {
          "v": "2005-03-24-12-4"
        },
        "BA4": {
          "v": "1"
        },
        "BA5": {
          "v": "1"
        },
        "BA6": {
          "v": "1"
        },
        "BA7": {
          "v": "0"
        },
        "BA8": {
          "v": "0"
        }
      },
      "BA2": "03/24/05",
      "BA3": "2005-03-24-12-4",
      "BA4": "1",
      "BA5": "1",
      "BA6": "1",
      "BA7": "0",
      "BA8": "0"
    },
    {
      "$uuid": 83,
      "$serverIndex": 83,
      "$rawV": {
        "BA2": {
          "fmt": null,
          "_fmtBySrv": null,
          "v": "20050325"
        },
        "BA3": {
          "v": "2005-03-25-12-5"
        },
        "BA4": {
          "v": "1"
        },
        "BA5": {
          "v": "1"
        },
        "BA6": {
          "v": "1"
        },
        "BA7": {
          "v": "0"
        },
        "BA8": {
          "v": "0"
        }
      },
      "BA2": "03/25/05",
      "BA3": "2005-03-25-12-5",
      "BA4": "1",
      "BA5": "1",
      "BA6": "1",
      "BA7": "0",
      "BA8": "0"
    },
    {
      "$uuid": 84,
      "$serverIndex": 84,
      "$rawV": {
        "BA2": {
          "fmt": null,
          "_fmtBySrv": null,
          "v": "20050326"
        },
        "BA3": {
          "v": "2005-03-26-12-6"
        },
        "BA4": {
          "v": "2"
        },
        "BA5": {
          "v": "0"
        },
        "BA6": {
          "v": "0"
        },
        "BA7": {
          "v": "0"
        },
        "BA8": {
          "v": "0"
        }
      },
      "BA2": "03/26/05",
      "BA3": "2005-03-26-12-6",
      "BA4": "2",
      "BA5": "0",
      "BA6": "0",
      "BA7": "0",
      "BA8": "0"
    },
    {
      "$uuid": 85,
      "$serverIndex": 85,
      "$rawV": {
        "BA2": {
          "fmt": null,
          "_fmtBySrv": null,
          "v": "20050327"
        },
        "BA3": {
          "v": "2005-03-27-12-7"
        },
        "BA4": {
          "v": "2"
        },
        "BA5": {
          "v": "0"
        },
        "BA6": {
          "v": "0"
        },
        "BA7": {
          "v": "0"
        },
        "BA8": {
          "v": "0"
        }
      },
      "BA2": "03/27/05",
      "BA3": "2005-03-27-12-7",
      "BA4": "2",
      "BA5": "0",
      "BA6": "0",
      "BA7": "0",
      "BA8": "0"
    },
    {
      "$uuid": 86,
      "$serverIndex": 86,
      "$rawV": {
        "BA2": {
          "fmt": null,
          "_fmtBySrv": null,
          "v": "20050328"
        },
        "BA3": {
          "v": "2005-03-28-13-1"
        },
        "BA4": {
          "v": "3"
        },
        "BA5": {
          "v": "0"
        },
        "BA6": {
          "v": "0"
        },
        "BA7": {
          "v": "0"
        },
        "BA8": {
          "v": "0"
        }
      },
      "BA2": "03/28/05",
      "BA3": "2005-03-28-13-1",
      "BA4": "3",
      "BA5": "0",
      "BA6": "0",
      "BA7": "0",
      "BA8": "0"
    },
    {
      "$uuid": 87,
      "$serverIndex": 87,
      "$rawV": {
        "BA2": {
          "fmt": null,
          "_fmtBySrv": null,
          "v": "20050329"
        },
        "BA3": {
          "v": "2005-03-29-13-2"
        },
        "BA4": {
          "v": "1"
        },
        "BA5": {
          "v": "1"
        },
        "BA6": {
          "v": "1"
        },
        "BA7": {
          "v": "0"
        },
        "BA8": {
          "v": "0"
        }
      },
      "BA2": "03/29/05",
      "BA3": "2005-03-29-13-2",
      "BA4": "1",
      "BA5": "1",
      "BA6": "1",
      "BA7": "0",
      "BA8": "0"
    },
    {
      "$uuid": 88,
      "$serverIndex": 88,
      "$rawV": {
        "BA2": {
          "fmt": null,
          "_fmtBySrv": null,
          "v": "20050330"
        },
        "BA3": {
          "v": "2005-03-30-13-3"
        },
        "BA4": {
          "v": "1"
        },
        "BA5": {
          "v": "1"
        },
        "BA6": {
          "v": "1"
        },
        "BA7": {
          "v": "0"
        },
        "BA8": {
          "v": "0"
        }
      },
      "BA2": "03/30/05",
      "BA3": "2005-03-30-13-3",
      "BA4": "1",
      "BA5": "1",
      "BA6": "1",
      "BA7": "0",
      "BA8": "0"
    },
    {
      "$uuid": 89,
      "$serverIndex": 89,
      "$rawV": {
        "BA2": {
          "fmt": null,
          "_fmtBySrv": null,
          "v": "20050331"
        },
        "BA3": {
          "v": "2005-03-31-13-4"
        },
        "BA4": {
          "v": "1"
        },
        "BA5": {
          "v": "1"
        },
        "BA6": {
          "v": "1"
        },
        "BA7": {
          "v": "0"
        },
        "BA8": {
          "v": "0"
        }
      },
      "BA2": "03/31/05",
      "BA3": "2005-03-31-13-4",
      "BA4": "1",
      "BA5": "1",
      "BA6": "1",
      "BA7": "0",
      "BA8": "0"
    },
    {
      "$uuid": 90,
      "$serverIndex": 90,
      "$rawV": {
        "BA2": {
          "fmt": null,
          "_fmtBySrv": null,
          "v": "20050401"
        },
        "BA3": {
          "v": "2005-04-01-13-5"
        },
        "BA4": {
          "v": "1"
        },
        "BA5": {
          "v": "1"
        },
        "BA6": {
          "v": "1"
        },
        "BA7": {
          "v": "0"
        },
        "BA8": {
          "v": "0"
        }
      },
      "BA2": "04/01/05",
      "BA3": "2005-04-01-13-5",
      "BA4": "1",
      "BA5": "1",
      "BA6": "1",
      "BA7": "0",
      "BA8": "0"
    },
    {
      "$uuid": 91,
      "$serverIndex": 91,
      "$rawV": {
        "BA2": {
          "fmt": null,
          "_fmtBySrv": null,
          "v": "20050402"
        },
        "BA3": {
          "v": "2005-04-02-13-6"
        },
        "BA4": {
          "v": "2"
        },
        "BA5": {
          "v": "0"
        },
        "BA6": {
          "v": "0"
        },
        "BA7": {
          "v": "0"
        },
        "BA8": {
          "v": "0"
        }
      },
      "BA2": "04/02/05",
      "BA3": "2005-04-02-13-6",
      "BA4": "2",
      "BA5": "0",
      "BA6": "0",
      "BA7": "0",
      "BA8": "0"
    },
    {
      "$uuid": 92,
      "$serverIndex": 92,
      "$rawV": {
        "BA2": {
          "fmt": null,
          "_fmtBySrv": null,
          "v": "20050403"
        },
        "BA3": {
          "v": "2005-04-03-13-7"
        },
        "BA4": {
          "v": "2"
        },
        "BA5": {
          "v": "0"
        },
        "BA6": {
          "v": "0"
        },
        "BA7": {
          "v": "0"
        },
        "BA8": {
          "v": "0"
        }
      },
      "BA2": "04/03/05",
      "BA3": "2005-04-03-13-7",
      "BA4": "2",
      "BA5": "0",
      "BA6": "0",
      "BA7": "0",
      "BA8": "0"
    },
    {
      "$uuid": 93,
      "$serverIndex": 93,
      "$rawV": {
        "BA2": {
          "fmt": null,
          "_fmtBySrv": null,
          "v": "20050404"
        },
        "BA3": {
          "v": "2005-04-04-14-1"
        },
        "BA4": {
          "v": "1"
        },
        "BA5": {
          "v": "1"
        },
        "BA6": {
          "v": "1"
        },
        "BA7": {
          "v": "0"
        },
        "BA8": {
          "v": "0"
        }
      },
      "BA2": "04/04/05",
      "BA3": "2005-04-04-14-1",
      "BA4": "1",
      "BA5": "1",
      "BA6": "1",
      "BA7": "0",
      "BA8": "0"
    },
    {
      "$uuid": 94,
      "$serverIndex": 94,
      "$rawV": {
        "BA2": {
          "fmt": null,
          "_fmtBySrv": null,
          "v": "20050405"
        },
        "BA3": {
          "v": "2005-04-05-14-2"
        },
        "BA4": {
          "v": "1"
        },
        "BA5": {
          "v": "1"
        },
        "BA6": {
          "v": "1"
        },
        "BA7": {
          "v": "0"
        },
        "BA8": {
          "v": "0"
        }
      },
      "BA2": "04/05/05",
      "BA3": "2005-04-05-14-2",
      "BA4": "1",
      "BA5": "1",
      "BA6": "1",
      "BA7": "0",
      "BA8": "0"
    },
    {
      "$uuid": 95,
      "$serverIndex": 95,
      "$rawV": {
        "BA2": {
          "fmt": null,
          "_fmtBySrv": null,
          "v": "20050406"
        },
        "BA3": {
          "v": "2005-04-06-14-3"
        },
        "BA4": {
          "v": "1"
        },
        "BA5": {
          "v": "1"
        },
        "BA6": {
          "v": "1"
        },
        "BA7": {
          "v": "0"
        },
        "BA8": {
          "v": "0"
        }
      },
      "BA2": "04/06/05",
      "BA3": "2005-04-06-14-3",
      "BA4": "1",
      "BA5": "1",
      "BA6": "1",
      "BA7": "0",
      "BA8": "0"
    },
    {
      "$uuid": 96,
      "$serverIndex": 96,
      "$rawV": {
        "BA2": {
          "fmt": null,
          "_fmtBySrv": null,
          "v": "20050407"
        },
        "BA3": {
          "v": "2005-04-07-14-4"
        },
        "BA4": {
          "v": "1"
        },
        "BA5": {
          "v": "1"
        },
        "BA6": {
          "v": "1"
        },
        "BA7": {
          "v": "0"
        },
        "BA8": {
          "v": "0"
        }
      },
      "BA2": "04/07/05",
      "BA3": "2005-04-07-14-4",
      "BA4": "1",
      "BA5": "1",
      "BA6": "1",
      "BA7": "0",
      "BA8": "0"
    },
    {
      "$uuid": 97,
      "$serverIndex": 97,
      "$rawV": {
        "BA2": {
          "fmt": null,
          "_fmtBySrv": null,
          "v": "20050408"
        },
        "BA3": {
          "v": "2005-04-08-14-5"
        },
        "BA4": {
          "v": "1"
        },
        "BA5": {
          "v": "1"
        },
        "BA6": {
          "v": "1"
        },
        "BA7": {
          "v": "0"
        },
        "BA8": {
          "v": "0"
        }
      },
      "BA2": "04/08/05",
      "BA3": "2005-04-08-14-5",
      "BA4": "1",
      "BA5": "1",
      "BA6": "1",
      "BA7": "0",
      "BA8": "0"
    },
    {
      "$uuid": 98,
      "$serverIndex": 98,
      "$rawV": {
        "BA2": {
          "fmt": null,
          "_fmtBySrv": null,
          "v": "20050409"
        },
        "BA3": {
          "v": "2005-04-09-14-6"
        },
        "BA4": {
          "v": "2"
        },
        "BA5": {
          "v": "0"
        },
        "BA6": {
          "v": "0"
        },
        "BA7": {
          "v": "0"
        },
        "BA8": {
          "v": "0"
        }
      },
      "BA2": "04/09/05",
      "BA3": "2005-04-09-14-6",
      "BA4": "2",
      "BA5": "0",
      "BA6": "0",
      "BA7": "0",
      "BA8": "0"
    },
    {
      "$uuid": 99,
      "$serverIndex": 99,
      "$rawV": {
        "BA2": {
          "fmt": null,
          "_fmtBySrv": null,
          "v": "20050410"
        },
        "BA3": {
          "v": "2005-04-10-14-7"
        },
        "BA4": {
          "v": "2"
        },
        "BA5": {
          "v": "0"
        },
        "BA6": {
          "v": "0"
        },
        "BA7": {
          "v": "0"
        },
        "BA8": {
          "v": "0"
        }
      },
      "BA2": "04/10/05",
      "BA3": "2005-04-10-14-7",
      "BA4": "2",
      "BA5": "0",
      "BA6": "0",
      "BA7": "0",
      "BA8": "0"
    },
    {
      "$uuid": 100,
      "$serverIndex": 100,
      "$rawV": {
        "BA2": {
          "fmt": null,
          "_fmtBySrv": null,
          "v": "20050411"
        },
        "BA3": {
          "v": "2005-04-11-15-1"
        },
        "BA4": {
          "v": "1"
        },
        "BA5": {
          "v": "1"
        },
        "BA6": {
          "v": "1"
        },
        "BA7": {
          "v": "0"
        },
        "BA8": {
          "v": "0"
        }
      },
      "BA2": "04/11/05",
      "BA3": "2005-04-11-15-1",
      "BA4": "1",
      "BA5": "1",
      "BA6": "1",
      "BA7": "0",
      "BA8": "0"
    },
    {
      "$uuid": 101,
      "$serverIndex": 101,
      "$rawV": {
        "BA2": {
          "fmt": null,
          "_fmtBySrv": null,
          "v": "20050412"
        },
        "BA3": {
          "v": "2005-04-12-15-2"
        },
        "BA4": {
          "v": "1"
        },
        "BA5": {
          "v": "1"
        },
        "BA6": {
          "v": "1"
        },
        "BA7": {
          "v": "0"
        },
        "BA8": {
          "v": "0"
        }
      },
      "BA2": "04/12/05",
      "BA3": "2005-04-12-15-2",
      "BA4": "1",
      "BA5": "1",
      "BA6": "1",
      "BA7": "0",
      "BA8": "0"
    },
    {
      "$uuid": 102,
      "$serverIndex": 102,
      "$rawV": {
        "BA2": {
          "fmt": null,
          "_fmtBySrv": null,
          "v": "20050413"
        },
        "BA3": {
          "v": "2005-04-13-15-3"
        },
        "BA4": {
          "v": "1"
        },
        "BA5": {
          "v": "1"
        },
        "BA6": {
          "v": "1"
        },
        "BA7": {
          "v": "0"
        },
        "BA8": {
          "v": "0"
        }
      },
      "BA2": "04/13/05",
      "BA3": "2005-04-13-15-3",
      "BA4": "1",
      "BA5": "1",
      "BA6": "1",
      "BA7": "0",
      "BA8": "0"
    },
    {
      "$uuid": 103,
      "$serverIndex": 103,
      "$rawV": {
        "BA2": {
          "fmt": null,
          "_fmtBySrv": null,
          "v": "20050414"
        },
        "BA3": {
          "v": "2005-04-14-15-4"
        },
        "BA4": {
          "v": "1"
        },
        "BA5": {
          "v": "1"
        },
        "BA6": {
          "v": "1"
        },
        "BA7": {
          "v": "0"
        },
        "BA8": {
          "v": "0"
        }
      },
      "BA2": "04/14/05",
      "BA3": "2005-04-14-15-4",
      "BA4": "1",
      "BA5": "1",
      "BA6": "1",
      "BA7": "0",
      "BA8": "0"
    },
    {
      "$uuid": 104,
      "$serverIndex": 104,
      "$rawV": {
        "BA2": {
          "fmt": null,
          "_fmtBySrv": null,
          "v": "20050415"
        },
        "BA3": {
          "v": "2005-04-15-15-5"
        },
        "BA4": {
          "v": "1"
        },
        "BA5": {
          "v": "1"
        },
        "BA6": {
          "v": "1"
        },
        "BA7": {
          "v": "0"
        },
        "BA8": {
          "v": "0"
        }
      },
      "BA2": "04/15/05",
      "BA3": "2005-04-15-15-5",
      "BA4": "1",
      "BA5": "1",
      "BA6": "1",
      "BA7": "0",
      "BA8": "0"
    },
    {
      "$uuid": 105,
      "$serverIndex": 105,
      "$rawV": {
        "BA2": {
          "fmt": null,
          "_fmtBySrv": null,
          "v": "20050416"
        },
        "BA3": {
          "v": "2005-04-16-15-6"
        },
        "BA4": {
          "v": "2"
        },
        "BA5": {
          "v": "0"
        },
        "BA6": {
          "v": "0"
        },
        "BA7": {
          "v": "0"
        },
        "BA8": {
          "v": "0"
        }
      },
      "BA2": "04/16/05",
      "BA3": "2005-04-16-15-6",
      "BA4": "2",
      "BA5": "0",
      "BA6": "0",
      "BA7": "0",
      "BA8": "0"
    },
    {
      "$uuid": 106,
      "$serverIndex": 106,
      "$rawV": {
        "BA2": {
          "fmt": null,
          "_fmtBySrv": null,
          "v": "20050417"
        },
        "BA3": {
          "v": "2005-04-17-15-7"
        },
        "BA4": {
          "v": "2"
        },
        "BA5": {
          "v": "0"
        },
        "BA6": {
          "v": "0"
        },
        "BA7": {
          "v": "0"
        },
        "BA8": {
          "v": "0"
        }
      },
      "BA2": "04/17/05",
      "BA3": "2005-04-17-15-7",
      "BA4": "2",
      "BA5": "0",
      "BA6": "0",
      "BA7": "0",
      "BA8": "0"
    },
    {
      "$uuid": 107,
      "$serverIndex": 107,
      "$rawV": {
        "BA2": {
          "fmt": null,
          "_fmtBySrv": null,
          "v": "20050418"
        },
        "BA3": {
          "v": "2005-04-18-16-1"
        },
        "BA4": {
          "v": "1"
        },
        "BA5": {
          "v": "1"
        },
        "BA6": {
          "v": "1"
        },
        "BA7": {
          "v": "0"
        },
        "BA8": {
          "v": "0"
        }
      },
      "BA2": "04/18/05",
      "BA3": "2005-04-18-16-1",
      "BA4": "1",
      "BA5": "1",
      "BA6": "1",
      "BA7": "0",
      "BA8": "0"
    },
    {
      "$uuid": 108,
      "$serverIndex": 108,
      "$rawV": {
        "BA2": {
          "fmt": null,
          "_fmtBySrv": null,
          "v": "20050419"
        },
        "BA3": {
          "v": "2005-04-19-16-2"
        },
        "BA4": {
          "v": "1"
        },
        "BA5": {
          "v": "1"
        },
        "BA6": {
          "v": "1"
        },
        "BA7": {
          "v": "0"
        },
        "BA8": {
          "v": "0"
        }
      },
      "BA2": "04/19/05",
      "BA3": "2005-04-19-16-2",
      "BA4": "1",
      "BA5": "1",
      "BA6": "1",
      "BA7": "0",
      "BA8": "0"
    },
    {
      "$uuid": 109,
      "$serverIndex": 109,
      "$rawV": {
        "BA2": {
          "fmt": null,
          "_fmtBySrv": null,
          "v": "20050420"
        },
        "BA3": {
          "v": "2005-04-20-16-3"
        },
        "BA4": {
          "v": "1"
        },
        "BA5": {
          "v": "1"
        },
        "BA6": {
          "v": "1"
        },
        "BA7": {
          "v": "0"
        },
        "BA8": {
          "v": "0"
        }
      },
      "BA2": "04/20/05",
      "BA3": "2005-04-20-16-3",
      "BA4": "1",
      "BA5": "1",
      "BA6": "1",
      "BA7": "0",
      "BA8": "0"
    },
    {
      "$uuid": 110,
      "$serverIndex": 110,
      "$rawV": {
        "BA2": {
          "fmt": null,
          "_fmtBySrv": null,
          "v": "20050421"
        },
        "BA3": {
          "v": "2005-04-21-16-4"
        },
        "BA4": {
          "v": "1"
        },
        "BA5": {
          "v": "1"
        },
        "BA6": {
          "v": "1"
        },
        "BA7": {
          "v": "0"
        },
        "BA8": {
          "v": "0"
        }
      },
      "BA2": "04/21/05",
      "BA3": "2005-04-21-16-4",
      "BA4": "1",
      "BA5": "1",
      "BA6": "1",
      "BA7": "0",
      "BA8": "0"
    },
    {
      "$uuid": 111,
      "$serverIndex": 111,
      "$rawV": {
        "BA2": {
          "fmt": null,
          "_fmtBySrv": null,
          "v": "20050422"
        },
        "BA3": {
          "v": "2005-04-22-16-5"
        },
        "BA4": {
          "v": "1"
        },
        "BA5": {
          "v": "1"
        },
        "BA6": {
          "v": "1"
        },
        "BA7": {
          "v": "0"
        },
        "BA8": {
          "v": "0"
        }
      },
      "BA2": "04/22/05",
      "BA3": "2005-04-22-16-5",
      "BA4": "1",
      "BA5": "1",
      "BA6": "1",
      "BA7": "0",
      "BA8": "0"
    },
    {
      "$uuid": 112,
      "$serverIndex": 112,
      "$rawV": {
        "BA2": {
          "fmt": null,
          "_fmtBySrv": null,
          "v": "20050423"
        },
        "BA3": {
          "v": "2005-04-23-16-6"
        },
        "BA4": {
          "v": "2"
        },
        "BA5": {
          "v": "0"
        },
        "BA6": {
          "v": "0"
        },
        "BA7": {
          "v": "0"
        },
        "BA8": {
          "v": "0"
        }
      },
      "BA2": "04/23/05",
      "BA3": "2005-04-23-16-6",
      "BA4": "2",
      "BA5": "0",
      "BA6": "0",
      "BA7": "0",
      "BA8": "0"
    },
    {
      "$uuid": 113,
      "$serverIndex": 113,
      "$rawV": {
        "BA2": {
          "fmt": null,
          "_fmtBySrv": null,
          "v": "20050424"
        },
        "BA3": {
          "v": "2005-04-24-16-7"
        },
        "BA4": {
          "v": "2"
        },
        "BA5": {
          "v": "0"
        },
        "BA6": {
          "v": "0"
        },
        "BA7": {
          "v": "0"
        },
        "BA8": {
          "v": "0"
        }
      },
      "BA2": "04/24/05",
      "BA3": "2005-04-24-16-7",
      "BA4": "2",
      "BA5": "0",
      "BA6": "0",
      "BA7": "0",
      "BA8": "0"
    },
    {
      "$uuid": 114,
      "$serverIndex": 114,
      "$rawV": {
        "BA2": {
          "fmt": null,
          "_fmtBySrv": null,
          "v": "20050425"
        },
        "BA3": {
          "v": "2005-04-25-17-1"
        },
        "BA4": {
          "v": "1"
        },
        "BA5": {
          "v": "1"
        },
        "BA6": {
          "v": "1"
        },
        "BA7": {
          "v": "0"
        },
        "BA8": {
          "v": "0"
        }
      },
      "BA2": "04/25/05",
      "BA3": "2005-04-25-17-1",
      "BA4": "1",
      "BA5": "1",
      "BA6": "1",
      "BA7": "0",
      "BA8": "0"
    },
    {
      "$uuid": 115,
      "$serverIndex": 115,
      "$rawV": {
        "BA2": {
          "fmt": null,
          "_fmtBySrv": null,
          "v": "20050426"
        },
        "BA3": {
          "v": "2005-04-26-17-2"
        },
        "BA4": {
          "v": "1"
        },
        "BA5": {
          "v": "1"
        },
        "BA6": {
          "v": "1"
        },
        "BA7": {
          "v": "0"
        },
        "BA8": {
          "v": "0"
        }
      },
      "BA2": "04/26/05",
      "BA3": "2005-04-26-17-2",
      "BA4": "1",
      "BA5": "1",
      "BA6": "1",
      "BA7": "0",
      "BA8": "0"
    },
    {
      "$uuid": 116,
      "$serverIndex": 116,
      "$rawV": {
        "BA2": {
          "fmt": null,
          "_fmtBySrv": null,
          "v": "20050427"
        },
        "BA3": {
          "v": "2005-04-27-17-3"
        },
        "BA4": {
          "v": "1"
        },
        "BA5": {
          "v": "1"
        },
        "BA6": {
          "v": "1"
        },
        "BA7": {
          "v": "0"
        },
        "BA8": {
          "v": "0"
        }
      },
      "BA2": "04/27/05",
      "BA3": "2005-04-27-17-3",
      "BA4": "1",
      "BA5": "1",
      "BA6": "1",
      "BA7": "0",
      "BA8": "0"
    },
    {
      "$uuid": 117,
      "$serverIndex": 117,
      "$rawV": {
        "BA2": {
          "fmt": null,
          "_fmtBySrv": null,
          "v": "20050428"
        },
        "BA3": {
          "v": "2005-04-28-17-4"
        },
        "BA4": {
          "v": "1"
        },
        "BA5": {
          "v": "1"
        },
        "BA6": {
          "v": "1"
        },
        "BA7": {
          "v": "0"
        },
        "BA8": {
          "v": "0"
        }
      },
      "BA2": "04/28/05",
      "BA3": "2005-04-28-17-4",
      "BA4": "1",
      "BA5": "1",
      "BA6": "1",
      "BA7": "0",
      "BA8": "0"
    },
    {
      "$uuid": 118,
      "$serverIndex": 118,
      "$rawV": {
        "BA2": {
          "fmt": null,
          "_fmtBySrv": null,
          "v": "20050429"
        },
        "BA3": {
          "v": "2005-04-29-17-5"
        },
        "BA4": {
          "v": "1"
        },
        "BA5": {
          "v": "1"
        },
        "BA6": {
          "v": "1"
        },
        "BA7": {
          "v": "0"
        },
        "BA8": {
          "v": "0"
        }
      },
      "BA2": "04/29/05",
      "BA3": "2005-04-29-17-5",
      "BA4": "1",
      "BA5": "1",
      "BA6": "1",
      "BA7": "0",
      "BA8": "0"
    },
    {
      "$uuid": 119,
      "$serverIndex": 119,
      "$rawV": {
        "BA2": {
          "fmt": null,
          "_fmtBySrv": null,
          "v": "20050430"
        },
        "BA3": {
          "v": "2005-04-30-17-6"
        },
        "BA4": {
          "v": "2"
        },
        "BA5": {
          "v": "0"
        },
        "BA6": {
          "v": "0"
        },
        "BA7": {
          "v": "0"
        },
        "BA8": {
          "v": "0"
        }
      },
      "BA2": "04/30/05",
      "BA3": "2005-04-30-17-6",
      "BA4": "2",
      "BA5": "0",
      "BA6": "0",
      "BA7": "0",
      "BA8": "0"
    },
    {
      "$uuid": 120,
      "$serverIndex": 120,
      "$rawV": {
        "BA2": {
          "fmt": null,
          "_fmtBySrv": null,
          "v": "20050501"
        },
        "BA3": {
          "v": "2005-05-01-17-7"
        },
        "BA4": {
          "v": "3"
        },
        "BA5": {
          "v": "0"
        },
        "BA6": {
          "v": "0"
        },
        "BA7": {
          "v": "0"
        },
        "BA8": {
          "v": "0"
        }
      },
      "BA2": "05/01/05",
      "BA3": "2005-05-01-17-7",
      "BA4": "3",
      "BA5": "0",
      "BA6": "0",
      "BA7": "0",
      "BA8": "0"
    },
    {
      "$uuid": 121,
      "$serverIndex": 121,
      "$rawV": {
        "BA2": {
          "fmt": null,
          "_fmtBySrv": null,
          "v": "20050502"
        },
        "BA3": {
          "v": "2005-05-02-18-1"
        },
        "BA4": {
          "v": "1"
        },
        "BA5": {
          "v": "1"
        },
        "BA6": {
          "v": "1"
        },
        "BA7": {
          "v": "0"
        },
        "BA8": {
          "v": "0"
        }
      },
      "BA2": "05/02/05",
      "BA3": "2005-05-02-18-1",
      "BA4": "1",
      "BA5": "1",
      "BA6": "1",
      "BA7": "0",
      "BA8": "0"
    },
    {
      "$uuid": 122,
      "$serverIndex": 122,
      "$rawV": {
        "BA2": {
          "fmt": null,
          "_fmtBySrv": null,
          "v": "20050503"
        },
        "BA3": {
          "v": "2005-05-03-18-2"
        },
        "BA4": {
          "v": "1"
        },
        "BA5": {
          "v": "1"
        },
        "BA6": {
          "v": "1"
        },
        "BA7": {
          "v": "0"
        },
        "BA8": {
          "v": "0"
        }
      },
      "BA2": "05/03/05",
      "BA3": "2005-05-03-18-2",
      "BA4": "1",
      "BA5": "1",
      "BA6": "1",
      "BA7": "0",
      "BA8": "0"
    },
    {
      "$uuid": 123,
      "$serverIndex": 123,
      "$rawV": {
        "BA2": {
          "fmt": null,
          "_fmtBySrv": null,
          "v": "20050504"
        },
        "BA3": {
          "v": "2005-05-04-18-3"
        },
        "BA4": {
          "v": "1"
        },
        "BA5": {
          "v": "1"
        },
        "BA6": {
          "v": "1"
        },
        "BA7": {
          "v": "0"
        },
        "BA8": {
          "v": "0"
        }
      },
      "BA2": "05/04/05",
      "BA3": "2005-05-04-18-3",
      "BA4": "1",
      "BA5": "1",
      "BA6": "1",
      "BA7": "0",
      "BA8": "0"
    },
    {
      "$uuid": 124,
      "$serverIndex": 124,
      "$rawV": {
        "BA2": {
          "fmt": null,
          "_fmtBySrv": null,
          "v": "20050505"
        },
        "BA3": {
          "v": "2005-05-05-18-4"
        },
        "BA4": {
          "v": "3"
        },
        "BA5": {
          "v": "0"
        },
        "BA6": {
          "v": "0"
        },
        "BA7": {
          "v": "0"
        },
        "BA8": {
          "v": "0"
        }
      },
      "BA2": "05/05/05",
      "BA3": "2005-05-05-18-4",
      "BA4": "3",
      "BA5": "0",
      "BA6": "0",
      "BA7": "0",
      "BA8": "0"
    },
    {
      "$uuid": 125,
      "$serverIndex": 125,
      "$rawV": {
        "BA2": {
          "fmt": null,
          "_fmtBySrv": null,
          "v": "20050506"
        },
        "BA3": {
          "v": "2005-05-06-18-5"
        },
        "BA4": {
          "v": "1"
        },
        "BA5": {
          "v": "1"
        },
        "BA6": {
          "v": "1"
        },
        "BA7": {
          "v": "0"
        },
        "BA8": {
          "v": "0"
        }
      },
      "BA2": "05/06/05",
      "BA3": "2005-05-06-18-5",
      "BA4": "1",
      "BA5": "1",
      "BA6": "1",
      "BA7": "0",
      "BA8": "0"
    },
    {
      "$uuid": 126,
      "$serverIndex": 126,
      "$rawV": {
        "BA2": {
          "fmt": null,
          "_fmtBySrv": null,
          "v": "20050507"
        },
        "BA3": {
          "v": "2005-05-07-18-6"
        },
        "BA4": {
          "v": "2"
        },
        "BA5": {
          "v": "0"
        },
        "BA6": {
          "v": "0"
        },
        "BA7": {
          "v": "0"
        },
        "BA8": {
          "v": "0"
        }
      },
      "BA2": "05/07/05",
      "BA3": "2005-05-07-18-6",
      "BA4": "2",
      "BA5": "0",
      "BA6": "0",
      "BA7": "0",
      "BA8": "0"
    },
    {
      "$uuid": 127,
      "$serverIndex": 127,
      "$rawV": {
        "BA2": {
          "fmt": null,
          "_fmtBySrv": null,
          "v": "20050508"
        },
        "BA3": {
          "v": "2005-05-08-18-7"
        },
        "BA4": {
          "v": "3"
        },
        "BA5": {
          "v": "0"
        },
        "BA6": {
          "v": "0"
        },
        "BA7": {
          "v": "0"
        },
        "BA8": {
          "v": "0"
        }
      },
      "BA2": "05/08/05",
      "BA3": "2005-05-08-18-7",
      "BA4": "3",
      "BA5": "0",
      "BA6": "0",
      "BA7": "0",
      "BA8": "0"
    },
    {
      "$uuid": 128,
      "$serverIndex": 128,
      "$rawV": {
        "BA2": {
          "fmt": null,
          "_fmtBySrv": null,
          "v": "20050509"
        },
        "BA3": {
          "v": "2005-05-09-19-1"
        },
        "BA4": {
          "v": "1"
        },
        "BA5": {
          "v": "1"
        },
        "BA6": {
          "v": "1"
        },
        "BA7": {
          "v": "0"
        },
        "BA8": {
          "v": "0"
        }
      },
      "BA2": "05/09/05",
      "BA3": "2005-05-09-19-1",
      "BA4": "1",
      "BA5": "1",
      "BA6": "1",
      "BA7": "0",
      "BA8": "0"
    },
    {
      "$uuid": 129,
      "$serverIndex": 129,
      "$rawV": {
        "BA2": {
          "fmt": null,
          "_fmtBySrv": null,
          "v": "20050510"
        },
        "BA3": {
          "v": "2005-05-10-19-2"
        },
        "BA4": {
          "v": "1"
        },
        "BA5": {
          "v": "1"
        },
        "BA6": {
          "v": "1"
        },
        "BA7": {
          "v": "0"
        },
        "BA8": {
          "v": "0"
        }
      },
      "BA2": "05/10/05",
      "BA3": "2005-05-10-19-2",
      "BA4": "1",
      "BA5": "1",
      "BA6": "1",
      "BA7": "0",
      "BA8": "0"
    },
    {
      "$uuid": 130,
      "$serverIndex": 130,
      "$rawV": {
        "BA2": {
          "fmt": null,
          "_fmtBySrv": null,
          "v": "20050511"
        },
        "BA3": {
          "v": "2005-05-11-19-3"
        },
        "BA4": {
          "v": "1"
        },
        "BA5": {
          "v": "1"
        },
        "BA6": {
          "v": "1"
        },
        "BA7": {
          "v": "0"
        },
        "BA8": {
          "v": "0"
        }
      },
      "BA2": "05/11/05",
      "BA3": "2005-05-11-19-3",
      "BA4": "1",
      "BA5": "1",
      "BA6": "1",
      "BA7": "0",
      "BA8": "0"
    },
    {
      "$uuid": 131,
      "$serverIndex": 131,
      "$rawV": {
        "BA2": {
          "fmt": null,
          "_fmtBySrv": null,
          "v": "20050512"
        },
        "BA3": {
          "v": "2005-05-12-19-4"
        },
        "BA4": {
          "v": "1"
        },
        "BA5": {
          "v": "1"
        },
        "BA6": {
          "v": "1"
        },
        "BA7": {
          "v": "0"
        },
        "BA8": {
          "v": "0"
        }
      },
      "BA2": "05/12/05",
      "BA3": "2005-05-12-19-4",
      "BA4": "1",
      "BA5": "1",
      "BA6": "1",
      "BA7": "0",
      "BA8": "0"
    },
    {
      "$uuid": 132,
      "$serverIndex": 132,
      "$rawV": {
        "BA2": {
          "fmt": null,
          "_fmtBySrv": null,
          "v": "20050513"
        },
        "BA3": {
          "v": "2005-05-13-19-5"
        },
        "BA4": {
          "v": "1"
        },
        "BA5": {
          "v": "1"
        },
        "BA6": {
          "v": "1"
        },
        "BA7": {
          "v": "0"
        },
        "BA8": {
          "v": "0"
        }
      },
      "BA2": "05/13/05",
      "BA3": "2005-05-13-19-5",
      "BA4": "1",
      "BA5": "1",
      "BA6": "1",
      "BA7": "0",
      "BA8": "0"
    },
    {
      "$uuid": 133,
      "$serverIndex": 133,
      "$rawV": {
        "BA2": {
          "fmt": null,
          "_fmtBySrv": null,
          "v": "20050514"
        },
        "BA3": {
          "v": "2005-05-14-19-6"
        },
        "BA4": {
          "v": "2"
        },
        "BA5": {
          "v": "0"
        },
        "BA6": {
          "v": "0"
        },
        "BA7": {
          "v": "0"
        },
        "BA8": {
          "v": "0"
        }
      },
      "BA2": "05/14/05",
      "BA3": "2005-05-14-19-6",
      "BA4": "2",
      "BA5": "0",
      "BA6": "0",
      "BA7": "0",
      "BA8": "0"
    },
    {
      "$uuid": 134,
      "$serverIndex": 134,
      "$rawV": {
        "BA2": {
          "fmt": null,
          "_fmtBySrv": null,
          "v": "20050515"
        },
        "BA3": {
          "v": "2005-05-15-19-7"
        },
        "BA4": {
          "v": "2"
        },
        "BA5": {
          "v": "0"
        },
        "BA6": {
          "v": "0"
        },
        "BA7": {
          "v": "0"
        },
        "BA8": {
          "v": "0"
        }
      },
      "BA2": "05/15/05",
      "BA3": "2005-05-15-19-7",
      "BA4": "2",
      "BA5": "0",
      "BA6": "0",
      "BA7": "0",
      "BA8": "0"
    },
    {
      "$uuid": 135,
      "$serverIndex": 135,
      "$rawV": {
        "BA2": {
          "fmt": null,
          "_fmtBySrv": null,
          "v": "20050516"
        },
        "BA3": {
          "v": "2005-05-16-20-1"
        },
        "BA4": {
          "v": "1"
        },
        "BA5": {
          "v": "1"
        },
        "BA6": {
          "v": "1"
        },
        "BA7": {
          "v": "0"
        },
        "BA8": {
          "v": "0"
        }
      },
      "BA2": "05/16/05",
      "BA3": "2005-05-16-20-1",
      "BA4": "1",
      "BA5": "1",
      "BA6": "1",
      "BA7": "0",
      "BA8": "0"
    },
    {
      "$uuid": 136,
      "$serverIndex": 136,
      "$rawV": {
        "BA2": {
          "fmt": null,
          "_fmtBySrv": null,
          "v": "20050517"
        },
        "BA3": {
          "v": "2005-05-17-20-2"
        },
        "BA4": {
          "v": "1"
        },
        "BA5": {
          "v": "1"
        },
        "BA6": {
          "v": "1"
        },
        "BA7": {
          "v": "0"
        },
        "BA8": {
          "v": "0"
        }
      },
      "BA2": "05/17/05",
      "BA3": "2005-05-17-20-2",
      "BA4": "1",
      "BA5": "1",
      "BA6": "1",
      "BA7": "0",
      "BA8": "0"
    },
    {
      "$uuid": 137,
      "$serverIndex": 137,
      "$rawV": {
        "BA2": {
          "fmt": null,
          "_fmtBySrv": null,
          "v": "20050518"
        },
        "BA3": {
          "v": "2005-05-18-20-3"
        },
        "BA4": {
          "v": "1"
        },
        "BA5": {
          "v": "1"
        },
        "BA6": {
          "v": "1"
        },
        "BA7": {
          "v": "0"
        },
        "BA8": {
          "v": "0"
        }
      },
      "BA2": "05/18/05",
      "BA3": "2005-05-18-20-3",
      "BA4": "1",
      "BA5": "1",
      "BA6": "1",
      "BA7": "0",
      "BA8": "0"
    },
    {
      "$uuid": 138,
      "$serverIndex": 138,
      "$rawV": {
        "BA2": {
          "fmt": null,
          "_fmtBySrv": null,
          "v": "20050519"
        },
        "BA3": {
          "v": "2005-05-19-20-4"
        },
        "BA4": {
          "v": "1"
        },
        "BA5": {
          "v": "1"
        },
        "BA6": {
          "v": "1"
        },
        "BA7": {
          "v": "0"
        },
        "BA8": {
          "v": "0"
        }
      },
      "BA2": "05/19/05",
      "BA3": "2005-05-19-20-4",
      "BA4": "1",
      "BA5": "1",
      "BA6": "1",
      "BA7": "0",
      "BA8": "0"
    },
    {
      "$uuid": 139,
      "$serverIndex": 139,
      "$rawV": {
        "BA2": {
          "fmt": null,
          "_fmtBySrv": null,
          "v": "20050520"
        },
        "BA3": {
          "v": "2005-05-20-20-5"
        },
        "BA4": {
          "v": "1"
        },
        "BA5": {
          "v": "1"
        },
        "BA6": {
          "v": "1"
        },
        "BA7": {
          "v": "0"
        },
        "BA8": {
          "v": "0"
        }
      },
      "BA2": "05/20/05",
      "BA3": "2005-05-20-20-5",
      "BA4": "1",
      "BA5": "1",
      "BA6": "1",
      "BA7": "0",
      "BA8": "0"
    },
    {
      "$uuid": 140,
      "$serverIndex": 140,
      "$rawV": {
        "BA2": {
          "fmt": null,
          "_fmtBySrv": null,
          "v": "20050521"
        },
        "BA3": {
          "v": "2005-05-21-20-6"
        },
        "BA4": {
          "v": "2"
        },
        "BA5": {
          "v": "0"
        },
        "BA6": {
          "v": "0"
        },
        "BA7": {
          "v": "0"
        },
        "BA8": {
          "v": "0"
        }
      },
      "BA2": "05/21/05",
      "BA3": "2005-05-21-20-6",
      "BA4": "2",
      "BA5": "0",
      "BA6": "0",
      "BA7": "0",
      "BA8": "0"
    },
    {
      "$uuid": 141,
      "$serverIndex": 141,
      "$rawV": {
        "BA2": {
          "fmt": null,
          "_fmtBySrv": null,
          "v": "20050522"
        },
        "BA3": {
          "v": "2005-05-22-20-7"
        },
        "BA4": {
          "v": "2"
        },
        "BA5": {
          "v": "0"
        },
        "BA6": {
          "v": "0"
        },
        "BA7": {
          "v": "0"
        },
        "BA8": {
          "v": "0"
        }
      },
      "BA2": "05/22/05",
      "BA3": "2005-05-22-20-7",
      "BA4": "2",
      "BA5": "0",
      "BA6": "0",
      "BA7": "0",
      "BA8": "0"
    },
    {
      "$uuid": 142,
      "$serverIndex": 142,
      "$rawV": {
        "BA2": {
          "fmt": null,
          "_fmtBySrv": null,
          "v": "20050523"
        },
        "BA3": {
          "v": "2005-05-23-21-1"
        },
        "BA4": {
          "v": "1"
        },
        "BA5": {
          "v": "1"
        },
        "BA6": {
          "v": "1"
        },
        "BA7": {
          "v": "0"
        },
        "BA8": {
          "v": "0"
        }
      },
      "BA2": "05/23/05",
      "BA3": "2005-05-23-21-1",
      "BA4": "1",
      "BA5": "1",
      "BA6": "1",
      "BA7": "0",
      "BA8": "0"
    },
    {
      "$uuid": 143,
      "$serverIndex": 143,
      "$rawV": {
        "BA2": {
          "fmt": null,
          "_fmtBySrv": null,
          "v": "20050524"
        },
        "BA3": {
          "v": "2005-05-24-21-2"
        },
        "BA4": {
          "v": "1"
        },
        "BA5": {
          "v": "1"
        },
        "BA6": {
          "v": "1"
        },
        "BA7": {
          "v": "0"
        },
        "BA8": {
          "v": "0"
        }
      },
      "BA2": "05/24/05",
      "BA3": "2005-05-24-21-2",
      "BA4": "1",
      "BA5": "1",
      "BA6": "1",
      "BA7": "0",
      "BA8": "0"
    },
    {
      "$uuid": 144,
      "$serverIndex": 144,
      "$rawV": {
        "BA2": {
          "fmt": null,
          "_fmtBySrv": null,
          "v": "20050525"
        },
        "BA3": {
          "v": "2005-05-25-21-3"
        },
        "BA4": {
          "v": "1"
        },
        "BA5": {
          "v": "1"
        },
        "BA6": {
          "v": "1"
        },
        "BA7": {
          "v": "0"
        },
        "BA8": {
          "v": "0"
        }
      },
      "BA2": "05/25/05",
      "BA3": "2005-05-25-21-3",
      "BA4": "1",
      "BA5": "1",
      "BA6": "1",
      "BA7": "0",
      "BA8": "0"
    },
    {
      "$uuid": 145,
      "$serverIndex": 145,
      "$rawV": {
        "BA2": {
          "fmt": null,
          "_fmtBySrv": null,
          "v": "20050526"
        },
        "BA3": {
          "v": "2005-05-26-21-4"
        },
        "BA4": {
          "v": "1"
        },
        "BA5": {
          "v": "1"
        },
        "BA6": {
          "v": "1"
        },
        "BA7": {
          "v": "0"
        },
        "BA8": {
          "v": "0"
        }
      },
      "BA2": "05/26/05",
      "BA3": "2005-05-26-21-4",
      "BA4": "1",
      "BA5": "1",
      "BA6": "1",
      "BA7": "0",
      "BA8": "0"
    },
    {
      "$uuid": 146,
      "$serverIndex": 146,
      "$rawV": {
        "BA2": {
          "fmt": null,
          "_fmtBySrv": null,
          "v": "20050527"
        },
        "BA3": {
          "v": "2005-05-27-21-5"
        },
        "BA4": {
          "v": "1"
        },
        "BA5": {
          "v": "1"
        },
        "BA6": {
          "v": "1"
        },
        "BA7": {
          "v": "0"
        },
        "BA8": {
          "v": "0"
        }
      },
      "BA2": "05/27/05",
      "BA3": "2005-05-27-21-5",
      "BA4": "1",
      "BA5": "1",
      "BA6": "1",
      "BA7": "0",
      "BA8": "0"
    },
    {
      "$uuid": 147,
      "$serverIndex": 147,
      "$rawV": {
        "BA2": {
          "fmt": null,
          "_fmtBySrv": null,
          "v": "20050528"
        },
        "BA3": {
          "v": "2005-05-28-21-6"
        },
        "BA4": {
          "v": "2"
        },
        "BA5": {
          "v": "0"
        },
        "BA6": {
          "v": "0"
        },
        "BA7": {
          "v": "0"
        },
        "BA8": {
          "v": "0"
        }
      },
      "BA2": "05/28/05",
      "BA3": "2005-05-28-21-6",
      "BA4": "2",
      "BA5": "0",
      "BA6": "0",
      "BA7": "0",
      "BA8": "0"
    },
    {
      "$uuid": 148,
      "$serverIndex": 148,
      "$rawV": {
        "BA2": {
          "fmt": null,
          "_fmtBySrv": null,
          "v": "20050529"
        },
        "BA3": {
          "v": "2005-05-29-21-7"
        },
        "BA4": {
          "v": "2"
        },
        "BA5": {
          "v": "0"
        },
        "BA6": {
          "v": "0"
        },
        "BA7": {
          "v": "0"
        },
        "BA8": {
          "v": "0"
        }
      },
      "BA2": "05/29/05",
      "BA3": "2005-05-29-21-7",
      "BA4": "2",
      "BA5": "0",
      "BA6": "0",
      "BA7": "0",
      "BA8": "0"
    },
    {
      "$uuid": 149,
      "$serverIndex": 149,
      "$rawV": {
        "BA2": {
          "fmt": null,
          "_fmtBySrv": null,
          "v": "20050530"
        },
        "BA3": {
          "v": "2005-05-30-22-1"
        },
        "BA4": {
          "v": "1"
        },
        "BA5": {
          "v": "1"
        },
        "BA6": {
          "v": "1"
        },
        "BA7": {
          "v": "0"
        },
        "BA8": {
          "v": "0"
        }
      },
      "BA2": "05/30/05",
      "BA3": "2005-05-30-22-1",
      "BA4": "1",
      "BA5": "1",
      "BA6": "1",
      "BA7": "0",
      "BA8": "0"
    },
    {
      "$uuid": 150,
      "$serverIndex": 150,
      "$rawV": {
        "BA2": {
          "fmt": null,
          "_fmtBySrv": null,
          "v": "20050531"
        },
        "BA3": {
          "v": "2005-05-31-22-2"
        },
        "BA4": {
          "v": "1"
        },
        "BA5": {
          "v": "1"
        },
        "BA6": {
          "v": "1"
        },
        "BA7": {
          "v": "0"
        },
        "BA8": {
          "v": "0"
        }
      },
      "BA2": "05/31/05",
      "BA3": "2005-05-31-22-2",
      "BA4": "1",
      "BA5": "1",
      "BA6": "1",
      "BA7": "0",
      "BA8": "0"
    },
    {
      "$uuid": 151,
      "$serverIndex": 151,
      "$rawV": {
        "BA2": {
          "fmt": null,
          "_fmtBySrv": null,
          "v": "20050601"
        },
        "BA3": {
          "v": "2005-06-01-22-3"
        },
        "BA4": {
          "v": "1"
        },
        "BA5": {
          "v": "1"
        },
        "BA6": {
          "v": "1"
        },
        "BA7": {
          "v": "0"
        },
        "BA8": {
          "v": "0"
        }
      },
      "BA2": "06/01/05",
      "BA3": "2005-06-01-22-3",
      "BA4": "1",
      "BA5": "1",
      "BA6": "1",
      "BA7": "0",
      "BA8": "0"
    },
    {
      "$uuid": 152,
      "$serverIndex": 152,
      "$rawV": {
        "BA2": {
          "fmt": null,
          "_fmtBySrv": null,
          "v": "20050602"
        },
        "BA3": {
          "v": "2005-06-02-22-4"
        },
        "BA4": {
          "v": "1"
        },
        "BA5": {
          "v": "1"
        },
        "BA6": {
          "v": "1"
        },
        "BA7": {
          "v": "0"
        },
        "BA8": {
          "v": "0"
        }
      },
      "BA2": "06/02/05",
      "BA3": "2005-06-02-22-4",
      "BA4": "1",
      "BA5": "1",
      "BA6": "1",
      "BA7": "0",
      "BA8": "0"
    },
    {
      "$uuid": 153,
      "$serverIndex": 153,
      "$rawV": {
        "BA2": {
          "fmt": null,
          "_fmtBySrv": null,
          "v": "20050603"
        },
        "BA3": {
          "v": "2005-06-03-22-5"
        },
        "BA4": {
          "v": "1"
        },
        "BA5": {
          "v": "1"
        },
        "BA6": {
          "v": "1"
        },
        "BA7": {
          "v": "0"
        },
        "BA8": {
          "v": "0"
        }
      },
      "BA2": "06/03/05",
      "BA3": "2005-06-03-22-5",
      "BA4": "1",
      "BA5": "1",
      "BA6": "1",
      "BA7": "0",
      "BA8": "0"
    },
    {
      "$uuid": 154,
      "$serverIndex": 154,
      "$rawV": {
        "BA2": {
          "fmt": null,
          "_fmtBySrv": null,
          "v": "20050604"
        },
        "BA3": {
          "v": "2005-06-04-22-6"
        },
        "BA4": {
          "v": "2"
        },
        "BA5": {
          "v": "0"
        },
        "BA6": {
          "v": "0"
        },
        "BA7": {
          "v": "0"
        },
        "BA8": {
          "v": "0"
        }
      },
      "BA2": "06/04/05",
      "BA3": "2005-06-04-22-6",
      "BA4": "2",
      "BA5": "0",
      "BA6": "0",
      "BA7": "0",
      "BA8": "0"
    },
    {
      "$uuid": 155,
      "$serverIndex": 155,
      "$rawV": {
        "BA2": {
          "fmt": null,
          "_fmtBySrv": null,
          "v": "20050605"
        },
        "BA3": {
          "v": "2005-06-05-22-7"
        },
        "BA4": {
          "v": "2"
        },
        "BA5": {
          "v": "0"
        },
        "BA6": {
          "v": "0"
        },
        "BA7": {
          "v": "0"
        },
        "BA8": {
          "v": "0"
        }
      },
      "BA2": "06/05/05",
      "BA3": "2005-06-05-22-7",
      "BA4": "2",
      "BA5": "0",
      "BA6": "0",
      "BA7": "0",
      "BA8": "0"
    },
    {
      "$uuid": 156,
      "$serverIndex": 156,
      "$rawV": {
        "BA2": {
          "fmt": null,
          "_fmtBySrv": null,
          "v": "20050606"
        },
        "BA3": {
          "v": "2005-06-06-23-1"
        },
        "BA4": {
          "v": "1"
        },
        "BA5": {
          "v": "1"
        },
        "BA6": {
          "v": "1"
        },
        "BA7": {
          "v": "0"
        },
        "BA8": {
          "v": "0"
        }
      },
      "BA2": "06/06/05",
      "BA3": "2005-06-06-23-1",
      "BA4": "1",
      "BA5": "1",
      "BA6": "1",
      "BA7": "0",
      "BA8": "0"
    },
    {
      "$uuid": 157,
      "$serverIndex": 157,
      "$rawV": {
        "BA2": {
          "fmt": null,
          "_fmtBySrv": null,
          "v": "20050607"
        },
        "BA3": {
          "v": "2005-06-07-23-2"
        },
        "BA4": {
          "v": "1"
        },
        "BA5": {
          "v": "1"
        },
        "BA6": {
          "v": "1"
        },
        "BA7": {
          "v": "0"
        },
        "BA8": {
          "v": "0"
        }
      },
      "BA2": "06/07/05",
      "BA3": "2005-06-07-23-2",
      "BA4": "1",
      "BA5": "1",
      "BA6": "1",
      "BA7": "0",
      "BA8": "0"
    },
    {
      "$uuid": 158,
      "$serverIndex": 158,
      "$rawV": {
        "BA2": {
          "fmt": null,
          "_fmtBySrv": null,
          "v": "20050608"
        },
        "BA3": {
